Title;Link;Session;Keywords
“It’s Complicated”: Negotiating Accessibility and (Mis)Representation in Image Descriptions of Race, Gender, and Disability;https://dl.acm.org/doi/fullHtml/10.1145/3411764.3445498;SESSION: Understanding Accessibility;Visual impairments, Race, Image descriptions, Gender, Disability, Blind, Accessibility, AI
The Burden of Survival: How Doctoral Students in Computing Bridge the Chasm of Inaccessibility;https://dl.acm.org/doi/fullHtml/10.1145/3411764.3445277;SESSION: Understanding Accessibility;Higher Education, Computing Education Research, Accessibility, Ableism
"Priorities, Technology, \&amp; Power: Co-Designing an Inclusive Transit Agenda in Kampala, Uganda";https://dl.acm.org/doi/fullHtml/10.1145/3411764.3445168;SESSION: Understanding Accessibility;Value-Sensitive Design, Uganda, Stakeholder Tokens Method, Power Dynamics, People with Disabilities, Kampala, Global South, Accessibility
Nuanced Perspectives Toward Disability Simulations from Digital Designers, Blind, Low Vision, and Color Blind People;https://dl.acm.org/doi/fullHtml/10.1145/3411764.3445620;SESSION: Understanding Accessibility;disability simulations., digital design, Accessibility
“I...Got my Nose-Print. But it Wasn’t Accurate”: How People with Upper Extremity Impairment Authenticate on their Personal Computing Devices;https://dl.acm.org/doi/fullHtml/10.1145/3411764.3445070;SESSION: Understanding Accessibility;upper extremity impairment, personal computing devices, authentication
Digital Design Marginalization: New Perspectives on Designing Inclusive Interfaces;https://dl.acm.org/doi/fullHtml/10.1145/3411764.3445180;SESSION: Understanding Accessibility;Social Marginalization, Social Exclusion, Older Adults, Marginalizing Design, Inclusive Design, Digital Inequality, Digital Inclusion, Digital Exclusion, Digital Divide, Digital Design Marginalization
Investigating the Accessibility of Crowdwork Tasks on Mechanical Turk;https://dl.acm.org/doi/fullHtml/10.1145/3411764.3445291;SESSION: Understanding Accessibility;disability, crowdwork, crowdsourcing, accessibility, MTurk, AMT
Explainable Automatic Evaluation of the Trail Making Test for Dementia Screening;https://dl.acm.org/doi/fullHtml/10.1145/3411764.3445046;SESSION: Understanding Accessibility;multimodal, explainable, digital pen, cognitive assessment, automatic scoring, Trail Making Test
Shing: A Conversational Agent to Alert Customers of Suspected Online-payment Fraud with Empathetical Communication Skills;https://dl.acm.org/doi/fullHtml/10.1145/3411764.3445129;SESSION: Computational Human-AI Conversation;Trust, Privacy, Digital finance, Customer service, Conversational Agent, Chatbot
Towards Mutual Theory of Mind in Human-AI Interaction: How Language Reflects What Students Perceive About a Virtual Teaching Assistant;https://dl.acm.org/doi/fullHtml/10.1145/3411764.3445645;SESSION: Computational Human-AI Conversation;theory of mind, online education, online community, language analysis, human-AI interaction, conversational agent
SEMOUR: A Scripted Emotional Speech Repository for Urdu;https://dl.acm.org/doi/fullHtml/10.1145/3411764.3445171;SESSION: Computational Human-AI Conversation;speech emotion recognition, speech dataset, machine learning, human annotation, digital recording, deep learning, Urdu language, Emotional speech
Planning for Natural Language Failures with the AI Playbook;https://dl.acm.org/doi/fullHtml/10.1145/3411764.3445735;SESSION: Computational Human-AI Conversation;prototyping, natural language technologies, Human-AI interaction, AI failures
Finding the Needle in a Haystack: On the Automatic Identification of Accessibility User Reviews;https://dl.acm.org/doi/fullHtml/10.1145/3411764.3445281;SESSION: Computational Human-AI Conversation;user review, machine learning., accessibility, Mobile application
The Disagreement Deconvolution: Bringing Machine Learning Performance Metrics In Line With Reality;https://dl.acm.org/doi/fullHtml/10.1145/3411764.3445423;SESSION: Computational Human-AI Conversation;
Designing Effective Interview Chatbots: Automatic Chatbot Profiling and Design Suggestion Generation for Chatbot Debugging;https://dl.acm.org/doi/fullHtml/10.1145/3411764.3445569;SESSION: Computational Human-AI Conversation;Interview Chatbot, Conversational AI Agents, Chatbot Evaluation Framework, Chatbot Design Suggestion, Chatbot Debugging, Automatic Chatbot Profiling, Automatic Chatbot Evaluation
Soliciting Stakeholders’ Fairness Notions in Child Maltreatment Predictive Systems;https://dl.acm.org/doi/fullHtml/10.1145/3411764.3445308;SESSION: Computational Human-AI Conversation;machine learning, human-centered AI, child welfare, algorithmic fairness, algorithm-assisted decision-making
Crowdsourcing More Effective Initializations for Single-Target Trackers Through Automatic Re-querying;https://dl.acm.org/doi/fullHtml/10.1145/3411764.3445181;SESSION: Computational Human-AI Conversation;smart replacement, single-target video object tracking, seed rejection, crowdsourcing, crowd-AI collaboration
A Human-AI Collaborative Approach for Clinical Decision Making on Rehabilitation Assessment;https://dl.acm.org/doi/fullHtml/10.1145/3411764.3445472;SESSION: Computational Human-AI Conversation;Stroke Rehabilitation Assessment, Personalization, Human-AI Interaction/Collaboration, Explainable and Interactive Machine Learning, Decision Support Systems
Directed Diversity: Leveraging Language Embedding Distances for Collective Creativity in Crowd Ideation;https://dl.acm.org/doi/fullHtml/10.1145/3411764.3445782;SESSION: Computational Human-AI Conversation;Motivational messaging, Ideation, Diversity, Crowdsourcing, Creativity Support Tool, Collective Intelligence, Collective Creativity
Cody: An AI-Based System to Semi-Automate Coding for Qualitative Research;https://dl.acm.org/doi/fullHtml/10.1145/3411764.3445591;SESSION: Computational Human-AI Conversation;User-centered design, Supervised machine learning, Rule-based coding, Qualitative research, Qualitative coding, Artifact design
Exploring Semi-Supervised Learning for Predicting Listener Backchannels;https://dl.acm.org/doi/fullHtml/10.1145/3411764.3445449;SESSION: Computational Human-AI Conversation;Multimodal analysis., Conversational Agents, Backchanneling
Social Sensemaking with AI: Designing an Open-ended AI Experience with a Blind Child;https://dl.acm.org/doi/fullHtml/10.1145/3411764.3445290;SESSION: Computational Human-AI Conversation;visual impairment, intelligent systems, human-AI interaction, human-AI collaboration, disability, design, children, blindness, accessibility, Human-centred AI
Eliciting Tech Futures Among Black Young Adults: A Case Study of Remote Speculative Co-Design;https://dl.acm.org/doi/fullHtml/10.1145/3411764.3445723;SESSION: HCI Confronting Issues of Race, Genders, Feminisms, Reproductive Health;speculative design, participatory design fictions, design workshops, co-design, Afrofuturism
Reducing Uncertainty and Offering Comfort: Designing Technology for Coping with Interpersonal Racism;https://dl.acm.org/doi/fullHtml/10.1145/3411764.3445590;SESSION: HCI Confronting Issues of Race, Genders, Feminisms, Reproductive Health;uncertainty, racism, participatory design, microaggressions, interactive fiction, design workshops
Diagnosing Bias in the Gender Representation of HCI Research Participants: How it Happens and Where We Are;https://dl.acm.org/doi/fullHtml/10.1145/3411764.3445383;SESSION: HCI Confronting Issues of Race, Genders, Feminisms, Reproductive Health;user studies, research, participants, meta-analysis, human-computer interaction, human subjects, gender bias, gender, dataset, data schema, HCI, CHI
Revisiting Gendered Web Forms: An Evaluation of Gender Inputs with (Non-)Binary People;https://dl.acm.org/doi/fullHtml/10.1145/3411764.3445742;SESSION: HCI Confronting Issues of Race, Genders, Feminisms, Reproductive Health;web forms, user interface design, survey methodology, input fields, Gender
"You’re Making Me Sick: A Systematic Review of How Virtual Reality Research Considers Gender \&amp; Cybersickness";https://dl.acm.org/doi/fullHtml/10.1145/3411764.3445701;SESSION: HCI Confronting Issues of Race, Genders, Feminisms, Reproductive Health;virtual reality, virtual environments, systematic review, simulator sickness, sex, gender, cybersickness
A Feminist Utopian Perspective on the Practice and Promise of Making;https://dl.acm.org/doi/fullHtml/10.1145/3411764.3445126;SESSION: HCI Confronting Issues of Race, Genders, Feminisms, Reproductive Health;feminist utopia, critical, Makerspace
Yes: Affirmative Consent as a Theoretical Framework for Understanding and Imagining Social Platforms;https://dl.acm.org/doi/fullHtml/10.1145/3411764.3445778;SESSION: HCI Confronting Issues of Race, Genders, Feminisms, Reproductive Health;socio-technical gap, social platform, consent, affirmative consent
Selling Glossy, Easy Futures: A Feminist Exploration of Commercial Mental-Health-focused Self-Care Apps’ Descriptions in the Google Play Store;https://dl.acm.org/doi/fullHtml/10.1145/3411764.3445500;SESSION: HCI Confronting Issues of Race, Genders, Feminisms, Reproductive Health;smartphone, self-care apps, self-care, mobile phone, mental health, feminist content analysis, feminism, content analysis, apps
What Can HCI Learn from Sexual Consent? A Feminist Process of Embodied Consent for Interactions with Emerging Technologies;https://dl.acm.org/doi/fullHtml/10.1145/3411764.3445107;SESSION: HCI Confronting Issues of Race, Genders, Feminisms, Reproductive Health;Feminist HCI, Embodied interactions, Consent
"Getting Ourselves Together: Data-centered participatory design research \&amp; epistemic burden";https://dl.acm.org/doi/fullHtml/10.1145/3411764.3445103;SESSION: HCI Confronting Issues of Race, Genders, Feminisms, Reproductive Health;Participatory Design, Critical/Activism/Ethics
The Technology Is Enemy for Me at the Moment: How Smart Home Technologies Assert Control Beyond Intent;https://dl.acm.org/doi/fullHtml/10.1145/3411764.3445058;SESSION: HCI Confronting Issues of Race, Genders, Feminisms, Reproductive Health;smart home, relationships, ethics, discipline, control mechanisms
Resisting the Medicalisation of Menopause: Reclaiming the Body through Design;https://dl.acm.org/doi/fullHtml/10.1145/3411764.3445153;SESSION: HCI Confronting Issues of Race, Genders, Feminisms, Reproductive Health;women’s health, soma design, menopause, feminist research
Caring for Intimate Data in Fertility Technologies;https://dl.acm.org/doi/fullHtml/10.1145/3411764.3445132;SESSION: HCI Confronting Issues of Race, Genders, Feminisms, Reproductive Health;women’s health, public health, privacy, Intimate data, GDPR
Vibrosight++: City-Scale Sensing Using Existing Retroreflective Signs and Markers;https://dl.acm.org/doi/fullHtml/10.1145/3411764.3445054;SESSION: Engineering Real-World Interaction;Ubiquitous Computing, Smart City, Sensing, Laser Vibrometry, Internet-of-Things
DistanciAR: Authoring Site-Specific Augmented Reality Experiences for Remote Environments;https://dl.acm.org/doi/fullHtml/10.1145/3411764.3445552;SESSION: Engineering Real-World Interaction;spatial design, remote authoring, augmented reality, 3D scanning
HandPainter - 3D Sketching in VR with Hand-based Physical Proxy;https://dl.acm.org/doi/fullHtml/10.1145/3411764.3445302;SESSION: Engineering Real-World Interaction;hand-based interaction, VR, 3D sketching
Augmenting Scientific Papers with Just-in-Time, Position-Sensitive Definitions of Terms and Symbols;https://dl.acm.org/doi/fullHtml/10.1145/3411764.3445648;SESSION: Engineering Real-World Interaction;scientific papers, reading interfaces, nonce words, interactive documents, definitions
Figaro: A Tabletop Authoring Environment for Human-Robot Interaction;https://dl.acm.org/doi/fullHtml/10.1145/3411764.3446864;SESSION: Engineering Real-World Interaction;tabletop interfaces, shadow puppetry, program synthesis, human-robot interaction, Authoring environments
Appliancizer: Transforming Web Pages into Electronic Devices;https://dl.acm.org/doi/fullHtml/10.1145/3411764.3445732;SESSION: Engineering Real-World Interaction;synthesis, human-computer interaction, electronic design automation, Web applications, PCB layout, HTML
CoCapture: Effectively Communicating UI Behaviors on Existing Websites by Demonstrating and Remixing;https://dl.acm.org/doi/fullHtml/10.1145/3411764.3445573;SESSION: Engineering Real-World Interaction;UI design communication, Rapid UI prototyping
AdapTutAR: An Adaptive Tutoring System for Machine Tasks in Augmented Reality;https://dl.acm.org/doi/fullHtml/10.1145/3411764.3445283;SESSION: Engineering Real-World Interaction;user state recognition, training/learning, manufacturing, adaptation
HapticSeer: A Multi-channel, Black-box, Platform-agnostic Approach to Detecting Video Game Events for Real-time Haptic Feedback;https://dl.acm.org/doi/fullHtml/10.1145/3411764.3445254;SESSION: Engineering Real-World Interaction;Multi-modal, Haptics, Event detection framework
Itsy-Bits: Fabrication and Recognition of 3D-Printed Tangibles with Small Footprints on Capacitive Touchscreens;https://dl.acm.org/doi/fullHtml/10.1145/3411764.3445502;SESSION: Engineering Real-World Interaction;Touchscreen, Tangibles, Machine Learning, 3D Printing
Oh, Snap! A Fabrication Pipeline to Magnetically Connect Conventional and 3D-Printed Electronics;https://dl.acm.org/doi/fullHtml/10.1145/3411764.3445641;SESSION: Engineering Real-World Interaction;touch, proximity, prototyping, capacitive sensing, 3D printing
WallTokens: Surface Tangibles for Vertical Displays;https://dl.acm.org/doi/fullHtml/10.1145/3411764.3445404;SESSION: Engineering Real-World Interaction;Wall-sized display, Tokens, Tangible Interaction, Fabrication
ArticuLev: An Integrated Self-Assembly Pipeline for Articulated Multi-Bead Levitation Primitives;https://dl.acm.org/doi/fullHtml/10.1145/3411764.3445342;SESSION: Engineering Real-World Interaction;
VINS: Visual Search for Mobile User Interface Design;https://dl.acm.org/doi/fullHtml/10.1145/3411764.3445762;SESSION: Design Tools / Machine Learning / Fabrication / Visual Artifacts in Design and Ideation;wireframes, user interface design, object detection, information retrieval, design examples, deep learning, datasets, data-driven design, computer vision
Documented: Embedding Information onto and Retrieving Information from 3D Printed Objects;https://dl.acm.org/doi/fullHtml/10.1145/3411764.3445551;SESSION: Design Tools / Machine Learning / Fabrication / Visual Artifacts in Design and Ideation;self-reflection, reflective learning, documentation, digital fabrication, data embedding and retrieval
Flower Jelly Printer: Slit Injection Printing for Parametrically Designed Flower Jelly;https://dl.acm.org/doi/fullHtml/10.1145/3411764.3445346;SESSION: Design Tools / Machine Learning / Fabrication / Visual Artifacts in Design and Ideation;interactive food, food-interaction design., food 3D printer, fabrication techniques, Digital food fabrication
Medical Maker Response to COVID-19: Distributed Manufacturing Infrastructure for Stopgap Protective Equipment;https://dl.acm.org/doi/fullHtml/10.1145/3411764.3445395;SESSION: Design Tools / Machine Learning / Fabrication / Visual Artifacts in Design and Ideation;
MetaMap: Supporting Visual Metaphor Ideation through Multi-dimensional Example-based Exploration;https://dl.acm.org/doi/fullHtml/10.1145/3411764.3445325;SESSION: Design Tools / Machine Learning / Fabrication / Visual Artifacts in Design and Ideation;Visual Metaphor, Design, Creativity Support Tool
Constructing Embodied Algebra by Sketching;https://dl.acm.org/doi/fullHtml/10.1145/3411764.3445460;SESSION: Design Tools / Machine Learning / Fabrication / Visual Artifacts in Design and Ideation;sketching, math modeling, embodied math, embodied cognition
Unmaking: Enabling and Celebrating the Creative Material of Failure, Destruction, Decay, and Deformation;https://dl.acm.org/doi/fullHtml/10.1145/3411764.3445529;SESSION: Design Tools / Machine Learning / Fabrication / Visual Artifacts in Design and Ideation;unmaking, temporality, sustainability, materiality, making, interaction design, digital fabrication, destruction, art
Picturing It!: The Effect of Image Styles on User Perceptions of Personas;https://dl.acm.org/doi/fullHtml/10.1145/3411764.3445360;SESSION: Design Tools / Machine Learning / Fabrication / Visual Artifacts in Design and Ideation;realism, pictures, anthropomorphism, Persona design
How Digital Tools Impact Convergent and Divergent Thinking in Design Ideation;https://dl.acm.org/doi/fullHtml/10.1145/3411764.3445062;SESSION: Design Tools / Machine Learning / Fabrication / Visual Artifacts in Design and Ideation;Divergent thinking, Creativity Support Tools, Creativity, Convergent Thinking
FlexTruss: A Computational Threading Method for Multi-material, Multi-form and Multi-use Prototyping;https://dl.acm.org/doi/fullHtml/10.1145/3411764.3445311;SESSION: Design Tools / Machine Learning / Fabrication / Visual Artifacts in Design and Ideation;Shape-changing interfaces, Personal fabrication, Mesh structures, Euler path, 3D printing
ShrinCage: 4D Printing Accessories that Self-Adapt;https://dl.acm.org/doi/fullHtml/10.1145/3411764.3445220;SESSION: Design Tools / Machine Learning / Fabrication / Visual Artifacts in Design and Ideation;Shape-changing interfaces, Self-adaptation, Do-It-Yourself, Design tool, 4D printing, 3D printing
Exquisite Fabrication: Exploring Turn-taking between Designers and Digital Fabrication Machines;https://dl.acm.org/doi/fullHtml/10.1145/3411764.3445236;SESSION: Design Tools / Machine Learning / Fabrication / Visual Artifacts in Design and Ideation;Turn-taking, Prototyping, Fabrication, Digital Craftsmanship
Limited Control Over the Body as Intriguing Play Design Resource;https://dl.acm.org/doi/fullHtml/10.1145/3411764.3445744;SESSION: Virtual Reality, Embodied Experiences, Toxicity;whole-body interaction, play, games, exertion, control, Bodily play
Tabletop Games in the Age of Remote Collaboration: Design Opportunities for a Socially Connected Game Experience;https://dl.acm.org/doi/fullHtml/10.1145/3411764.3445512;SESSION: Virtual Reality, Embodied Experiences, Toxicity;Tabletop games, Social connectedness, Remote play
Flag and Flaggability in Automated Moderation: The Case of Reporting Toxic Behavior in an Online Game Community;https://dl.acm.org/doi/fullHtml/10.1145/3411764.3445279;SESSION: Virtual Reality, Embodied Experiences, Toxicity;toxicity, toxic meritocracy, toxic behavior, regulation, online community, moderation, governance, flag, competitive gaming, Report, League of Legends
Don’t You Know That You’re Toxic: Normalization of Toxicity in Online Gaming;https://dl.acm.org/doi/fullHtml/10.1145/3411764.3445157;SESSION: Virtual Reality, Embodied Experiences, Toxicity;toxicity, toxic, normalization, moral disengagement, games
Effect of Gameplay Uncertainty, Display Type, and Age on Virtual Reality Exergames;https://dl.acm.org/doi/fullHtml/10.1145/3411764.3445801;SESSION: Virtual Reality, Embodied Experiences, Toxicity;young adults, virtual reality, uncertainty, middle-aged adults, exergame
Physical Warm-up Games: Exploring the Potential of Play and Technology Design;https://dl.acm.org/doi/fullHtml/10.1145/3411764.3445163;SESSION: Virtual Reality, Embodied Experiences, Toxicity;
Restraints as a Mechanic for Bodily Play;https://dl.acm.org/doi/fullHtml/10.1145/3411764.3445622;SESSION: Virtual Reality, Embodied Experiences, Toxicity;Restraints, Phenomenology, Movement-Based Games, Interaction Design, Game Design, Body Games, Bodily Play Experiences, Bodily Play
Exploring the Design Space of Immersive Social Fitness Games: The ImSoFit Games Model;https://dl.acm.org/doi/fullHtml/10.1145/3411764.3445592;SESSION: Virtual Reality, Embodied Experiences, Toxicity;social immersion, multiplayer, mixed reality, fitness game, exergame, embodied sketching, design space
Feels like Team Spirit: Biometric and Strategic Interdependence in Asymmetric Multiplayer VR Games;https://dl.acm.org/doi/fullHtml/10.1145/3411764.3445492;SESSION: Virtual Reality, Embodied Experiences, Toxicity;virtual reality, strategic, multiplayer, interdependence, biometric, asymmetry, VR
Towards the Next Generation of Gaming Wearables;https://dl.acm.org/doi/fullHtml/10.1145/3411764.3445785;SESSION: Virtual Reality, Embodied Experiences, Toxicity;Wearables, Virtual Reality, Social Interaction, Role Playing, RPG, Movement-Based Games, LARP, Game Research, Game Controllers, Costuming, Bioadaptive
Streaming VR Games to the Broad Audience: A Comparison of the First-Person and Third-Person Perspectives;https://dl.acm.org/doi/fullHtml/10.1145/3411764.3445515;SESSION: Virtual Reality, Embodied Experiences, Toxicity;virtual reality, third-person, streaming, spectator, perspective, games, first-person
"Using Intersectional Representation \&amp; Embodied Identification in Standard Video Game Play to Reduce Societal Biases";https://dl.acm.org/doi/fullHtml/10.1145/3411764.3445161;SESSION: Virtual Reality, Embodied Experiences, Toxicity;virtual characters, video games, representation, racial bias, intersectionality, identification, gender bias, embodiment
Journalistic Source Discovery: Supporting The Identification of News Sources in User Generated Content;https://dl.acm.org/doi/fullHtml/10.1145/3411764.3445266;SESSION: Combining Digital and Analogue Presence in Online Work;user-generated content, sensemaking, journalistic sourcing, crowd-sourcing journalism, citizen journalism, Computational journalism
Large Scale Analysis of Multitasking Behavior During Remote Meetings;https://dl.acm.org/doi/fullHtml/10.1145/3411764.3445243;SESSION: Combining Digital and Analogue Presence in Online Work;remote work, meeting, collaboration, Multitasking
Comparing Generic and Community-Situated Crowdsourcing for Data Validation in the Context of Recovery from Substance Use Disorders;https://dl.acm.org/doi/fullHtml/10.1145/3411764.3445399;SESSION: Combining Digital and Analogue Presence in Online Work;community-situated crowd, Crowdsourcing, Alcoholics Anonymous
Designing Telepresence Drones to Support Synchronous, Mid-air Remote Collaboration: An Exploratory Study;https://dl.acm.org/doi/fullHtml/10.1145/3411764.3445041;SESSION: Combining Digital and Analogue Presence in Online Work;User Interface, UAV, Telepresence, Remote collaboration, Quadcopters, Drones, Collaborative work, Collaborative remote control
MirrorBlender: Supporting Hybrid Meetings with a Malleable Video-Conferencing System;https://dl.acm.org/doi/fullHtml/10.1145/3411764.3445698;SESSION: Combining Digital and Analogue Presence in Online Work;video conferencing, shareable dynamic media, inclusive meetings, blended interaction spaces, Hybrid meetings
Uncovering the Promises and Challenges of Social Media Use in the Low-Wage Labor Market: Insights from Employers;https://dl.acm.org/doi/fullHtml/10.1145/3411764.3445774;SESSION: Combining Digital and Analogue Presence in Online Work;workplace studies, recruitment, power asymmetries, materiality, low-wage worker, impression management, Social media
Winder: Linking Speech and Visual Objects to Support Communication in Asynchronous Collaboration;https://dl.acm.org/doi/fullHtml/10.1145/3411764.3445686;SESSION: Combining Digital and Analogue Presence in Online Work;Voice, Visual Document, User Interface Design., Team Collaboration, Speech, Multimodal Input, Asynchronous Communication
Current Practices, Challenges, and Design Implications for Collaborative AR/VR Application Development;https://dl.acm.org/doi/fullHtml/10.1145/3411764.3445335;SESSION: Combining Digital and Analogue Presence in Online Work;practitioners, authoring tools, XR, MR, Augmented Reality, AR/VR, AR development, AR design
“Why lose control?” A Study of Freelancers’ Experiences with Gig Economy Platforms;https://dl.acm.org/doi/fullHtml/10.1145/3411764.3445305;SESSION: Combining Digital and Analogue Presence in Online Work;Worker-centered design, Upwork, Reddit, Gig economy, Freelancing platforms, Freelance work, Fiverr
Using Boolean Satisfiability Solvers to Help Reduce Cognitive Load and Improve Decision Making when Creating Common Academic Schedules;https://dl.acm.org/doi/fullHtml/10.1145/3411764.3445681;SESSION: Combining Digital and Analogue Presence in Online Work;Student Scheduling, SAT Solver, Human-Centered Design, Decision Making, Constraint Satisfaction, Cognitive Load, Boolean Satisfiability
The Role of Social Presence for Cooperation in Augmented Reality on Head Mounted Devices: A Literature Review;https://dl.acm.org/doi/fullHtml/10.1145/3411764.3445633;SESSION: Combining Digital and Analogue Presence in Online Work;User Study, Social Presence, Presence Questionnaire, Literature Review, Head Mounted Devices, Cooperation, Augmented Reality
Tele-Immersive Improv: Effects of Immersive Visualisations on Rehearsing and Performing Theatre Online;https://dl.acm.org/doi/fullHtml/10.1145/3411764.3445310;SESSION: Combining Digital and Analogue Presence in Online Work;tele-presence, tele-immersion, presence, mixed reality, improvisation, immersive communication, creativity
Grand Challenges in Immersive Analytics;https://dl.acm.org/doi/fullHtml/10.1145/3411764.3446866;SESSION: Novel Visualization Techniques;virtual reality, grand research challenges, data visualisation, augmented reality, Immersive analytics
Quantitative Data Visualisation on Virtual Globes;https://dl.acm.org/doi/fullHtml/10.1145/3411764.3445152;SESSION: Novel Visualization Techniques;virtual globes, quantitative data visualisation, geovisualisation
Towards an Understanding of Situated AR Visualization for Basketball Free-Throw Training;https://dl.acm.org/doi/fullHtml/10.1145/3411764.3445649;SESSION: Novel Visualization Techniques;SportsXR, Situated Analytics, Immersive Analytics, Data Visualization, Augmented Reality
