Title;Link;Session;Keywords
Auditing E-Commerce Platforms for Algorithmically Curated Vaccine Misinformation;https://dl.acm.org/doi/fullHtml/10.1145/3411764.3445250;"SESSION: Trust, Transparency &amp; Sharing Online";algorithmic audits, algorithmic bias, e-commerce platforms, health misinformation, personalization, recommendations, search engines, search results, vaccine misinformation
Feeling Colours: Crossmodal Correspondences Between Tangible 3D Objects, Colours and Emotions;https://dl.acm.org/doi/fullHtml/10.1145/3411764.3445373;SESSION: Interaction Techniques / Sketch and Illustration / Privacy;3D Printing, Bouba, Colour, Crossmodal Correspondences, Emotions, Kiki, Multisensory Interaction, Touch
Interaction Illustration Taxonomy: Classification of Styles and Techniques for Visually Representing Interaction Scenarios;https://dl.acm.org/doi/fullHtml/10.1145/3411764.3445586;SESSION: Interaction Techniques / Sketch and Illustration / Privacy;figures, interaction illustrations, interactive scenarios, taxonomy
Color by Numbers: Interactive Structuring and Vectorization of Sketch Imagery;https://dl.acm.org/doi/fullHtml/10.1145/3411764.3445215;SESSION: Interaction Techniques / Sketch and Illustration / Privacy;
CASSIE: Curve and Surface Sketching in Immersive Environments;https://dl.acm.org/doi/fullHtml/10.1145/3411764.3445158;SESSION: Interaction Techniques / Sketch and Illustration / Privacy;concept modeling, curve networks, ideation, immersive design
KeyTch: Combining the Keyboard with a Touchscreen for Rapid Command Selection on Toolbars;https://dl.acm.org/doi/fullHtml/10.1145/3411764.3445288;SESSION: Interaction Techniques / Sketch and Illustration / Privacy;Command selection, Interaction techniques, Menu, Mobile device, Object-to-Command Transition, Ribbon, Toolbar
Distractor Effects on Crossing-Based Interaction;https://dl.acm.org/doi/fullHtml/10.1145/3411764.3445340;SESSION: Interaction Techniques / Sketch and Illustration / Privacy;Crossing, Fitts’ law, distractor effects, models., pointing
Impact of Task on Attentional Tunneling in Handheld Augmented Reality;https://dl.acm.org/doi/fullHtml/10.1145/3411764.3445580;SESSION: Interaction Techniques / Sketch and Illustration / Privacy;Attentional Tunneling, Augmented Reality, Mobile Devices
Preserving Agency During Electrical Muscle Stimulation Training Speeds up Reaction Time Directly After Removing EMS;https://dl.acm.org/doi/fullHtml/10.1145/3411764.3445147;SESSION: Interaction Techniques / Sketch and Illustration / Privacy;agency, electrical muscle stimulation, reaction time
Interaction Pace and User Preferences;https://dl.acm.org/doi/fullHtml/10.1145/3411764.3445772;SESSION: Interaction Techniques / Sketch and Illustration / Privacy;Interaction pace convergence, timeouts, user preferences.
BackSwipe: Back-of-device Word-Gesture Interaction on Smartphones;https://dl.acm.org/doi/fullHtml/10.1145/3411764.3445081;SESSION: Interaction Techniques / Sketch and Illustration / Privacy;Text entry, command input, smartphones., touchscreen, word-gesture shortcuts
PhraseFlow: Designs and Empirical Studies of Phrase-Level Input;https://dl.acm.org/doi/fullHtml/10.1145/3411764.3445166;SESSION: Interaction Techniques / Sketch and Illustration / Privacy;Text entry, autocorrection, keyboard, phrase-level input
PrivacyMic: Utilizing Inaudible Frequencies for Privacy Preserving Daily Activity Recognition;https://dl.acm.org/doi/fullHtml/10.1145/3411764.3445169;SESSION: Interaction Techniques / Sketch and Illustration / Privacy;Acoustics, Infrasound, Internet of Things, IoT, Microphones, Smart Environments, Sound Sensing, Ubiquitous Sensing, Ultrasound
Think-Aloud Computing: Supporting Rich and Low-Effort Knowledge Capture;https://dl.acm.org/doi/fullHtml/10.1145/3411764.3445066;SESSION: Interaction Techniques / Sketch and Illustration / Privacy;Think-aloud, documentation, knowledge capture, process
Comparing Perspectives Around Human and Technology Support for Contact Tracing;https://dl.acm.org/doi/fullHtml/10.1145/3411764.3445669;SESSION: Personal Health Data;COVID-19, Contact tracing, Crisis informatics, Personal informatics, Public health, Self-tracking
Examining Mobility Among People Living with HIV in Rural Areas;https://dl.acm.org/doi/fullHtml/10.1145/3411764.3445086;SESSION: Personal Health Data;HIV Care and Management, Mobility, Rural Communities, Transportation Barriers
Living with Uncertainty and Stigma: Self-Experimentation and Support-Seeking around Polycystic Ovary Syndrome;https://dl.acm.org/doi/fullHtml/10.1145/3411764.3445706;SESSION: Personal Health Data;Chronic Condition, Enigmatic, PCOS, Self-Experimentation, Self-Management, Self-Tracking, Stigma, Support, Women’s Health
StoryMap: Using Social Modeling and Self-Modeling to Support Physical Activity Among Families of Low-SES Backgrounds;https://dl.acm.org/doi/fullHtml/10.1145/3411764.3445087;SESSION: Personal Health Data;Family, Health, Low-SES, Physical Activity, Self-Efficacy, Self-Modeling, Social Cognitive Theory, Social Modeling
Health Data in Fertility Care: An Ecological Perspective;https://dl.acm.org/doi/fullHtml/10.1145/3411764.3445189;SESSION: Personal Health Data;Ecological models, Fertility self-tracking, Personal Informatics
Online Transgender Health Information Seeking: Facilitators, Barriers, and Future Directions;https://dl.acm.org/doi/fullHtml/10.1145/3411764.3445091;SESSION: Personal Health Data;content moderation, health, misinformation, nonbinary, online communities, online health information seeking, privacy, social media, transgender
From Reflection to Action: Combining Machine Learning with Expert Knowledge for Nutrition Goal Recommendations;https://dl.acm.org/doi/fullHtml/10.1145/3411764.3445555;SESSION: Personal Health Data;Diabetes self-management, Goal setting, Machine learning, Personal Informatics
The Medical Authority of AI: A Study of AI-enabled Consumer-Facing Health Technology;https://dl.acm.org/doi/fullHtml/10.1145/3411764.3445657;SESSION: Personal Health Data;Artificial intelligence, Consumer-facing health technology, Medical authority, Symptom checkers
Avoiding Reactions Outside the Home: Challenges, Strategies, and Opportunities to Enhance Dining Out Experiences of People with Food Hypersensitivities;https://dl.acm.org/doi/fullHtml/10.1145/3411764.3445662;SESSION: Personal Health Data;Food hypersensitivities, avoiding reactions, dining out, food allergies, food intolerance, health, qualitative research, self-care
Assessing MyData Scenarios: Ethics, Concerns, and the Promise;https://dl.acm.org/doi/fullHtml/10.1145/3411764.3445213;SESSION: Personal Health Data;Crowdsourcing, Ethics, Healthcare, MyData, Privacy
“They don’t always think about that”: Translational Needs in the Design of Personal Health Informatics Applications;https://dl.acm.org/doi/fullHtml/10.1145/3411764.3445587;SESSION: Personal Health Data;Health Design, Personal Health Informatics, Translational Research
Understanding the Role of Technology to Support Breastfeeding;https://dl.acm.org/doi/fullHtml/10.1145/3411764.3445247;SESSION: Personal Health Data;Breastfeeding, Integrated Behavioral Model
Heterogeneous Stroke: Using Unique Vibration Cues to Improve the Wrist-Worn Spatiotemporal Tactile Display;https://dl.acm.org/doi/fullHtml/10.1145/3411764.3445448;SESSION: Haptics;Spatiotemporal Tactile Pattern, Wearable Tactile Display, Wrist-Worn Tactile Display
MagnetIO: Passive yet Interactive Soft Haptic Patches Anywhere;https://dl.acm.org/doi/fullHtml/10.1145/3411764.3445543;SESSION: Haptics;fabrication, soft magnets, ubiquitous haptics
ThermoCaress: A Wearable Haptic Device with Illusory Moving Thermal Stimulation;https://dl.acm.org/doi/fullHtml/10.1145/3411764.3445777;SESSION: Haptics;Haptics, Pneumatic actuation, Soft wearable device, Thermal referral, Thermal stroking
“Grip-that-there”: An Investigation of Explicit and Implicit Task Allocation Techniques for Human-Robot Collaboration;https://dl.acm.org/doi/fullHtml/10.1145/3411764.3445355;SESSION: Haptics;Human-robot task allocation, human-robot collaboration
Increasing Electrical Muscle Stimulation's Dexterity by means of Back of the Hand Actuation;https://dl.acm.org/doi/fullHtml/10.1145/3411764.3445761;SESSION: Haptics;EMS, Electrical muscle stimulation, dexterity, haptic actuation
Ungrounded Vari-Dimensional Tactile Fingertip Feedback for Virtual Object Interaction;https://dl.acm.org/doi/fullHtml/10.1145/3411764.3445369;SESSION: Haptics;fingertip, haptic exploration, six-degree-of-freedom, tactile feedback, wearable
GuideCopter - A Precise Drone-Based Haptic Guidance Interface for Blind or Visually Impaired People;https://dl.acm.org/doi/fullHtml/10.1145/3411764.3445676;SESSION: Haptics;guidance, haptic interface, localization, tracking, visually challenged people
Squish This: Force Input on Soft Surfacesfor Visual Targeting Tasks;https://dl.acm.org/doi/fullHtml/10.1145/3411764.3445623;SESSION: Haptics;Force Input, Pressure Input, Soft Surfaces, User Study
Visuo-haptic Illusions for Linear Translation and Stretching using Physical Proxies in Virtual Reality;https://dl.acm.org/doi/fullHtml/10.1145/3411764.3445456;SESSION: Haptics;Haptics, Proxy Objects, Tangible Interfaces, Virtual Reality, Visuo-haptic Illusions
Soma-noti: Delivering Notifications Through Under-clothing Wearables;https://dl.acm.org/doi/fullHtml/10.1145/3411764.3445123;SESSION: Haptics;Notifications, badge, wearable output
“Good Enough!”: Flexible Goal Achievement with Margin-based Outcome Evaluation;https://dl.acm.org/doi/fullHtml/10.1145/3411764.3445608;"SESSION: Health &amp; Behavior Change";Behavior Change, Interview, Service Design, User Experience Design
“That courage to encourage”: Participation and Aspirations in Chat-based Peer Support for Youth Living with HIV;https://dl.acm.org/doi/fullHtml/10.1145/3411764.3445313;"SESSION: Health &amp; Behavior Change";Kenya, WhatsApp, aspirations, chat apps, health, peer support
Transgender People’s Technology Needs to Support Health and Transition;https://dl.acm.org/doi/fullHtml/10.1145/3411764.3445276;"SESSION: Health &amp; Behavior Change";gender dysphoria, inclusive design, information management, transgender health, wellness
Can You Hear My Heartbeat?: Hearing an Expressive Biosignal Elicits Empathy;https://dl.acm.org/doi/fullHtml/10.1145/3411764.3445545;"SESSION: Health &amp; Behavior Change";AAC, ASD, affect, communication, emotion, empathy, heart rate, music, physiology, rhythm, sound
“It’s About Missing Much More Than the People”: How Students use Digital Technologies to Alleviate Homesickness;https://dl.acm.org/doi/fullHtml/10.1145/3411764.3445362;"SESSION: Health &amp; Behavior Change";"Home, Homesickness, Migrants, Students;"
Self-E: Smartphone-Supported Guidance for Customizable Self-Experimentation;https://dl.acm.org/doi/fullHtml/10.1145/3411764.3445100;"SESSION: Health &amp; Behavior Change";personal informatics, self-experiments, self-tracking
TiltChair: Manipulative Posture Guidance by Actively Inclining the Seat of an Office Chair;https://dl.acm.org/doi/fullHtml/10.1145/3411764.3445151;"SESSION: Health &amp; Behavior Change";actuated furniture, adaptive workplaces, posture change, well-being
Not Now, Ask Later: Users Weaken Their Behavior Change Regimen Over Time, But Expect To Re-Strengthen It Imminently;https://dl.acm.org/doi/fullHtml/10.1145/3411764.3445695;"SESSION: Health &amp; Behavior Change";behavior change, distractions and interruptions
Sticky Goals: Understanding Goal Commitments for Behavioral Changes in the Wild;https://dl.acm.org/doi/fullHtml/10.1145/3411764.3445295;"SESSION: Health &amp; Behavior Change";Commitment Device, Goal-Setting, Online Behavior Change Support Systems, Usage Data Analysis
Illustrating the Gaps and Needs in the Training Support of Community Health Workers in India;https://dl.acm.org/doi/fullHtml/10.1145/3411764.3445111;"SESSION: Health &amp; Behavior Change";ASHA, CHW, HCI4D, ICTD, mHealth
Religion and Women’s Intimate Health: Towards an Inclusive Approach to Healthcare;https://dl.acm.org/doi/fullHtml/10.1145/3411764.3445605;"SESSION: Health &amp; Behavior Change";Islam, health design, menarche, menopause, religion, women’s health
KiTT - The Kinaesthetics Transfer Teacher: Design and Evaluation of a Tablet-based System to Promote the Learning of Ergonomic Patient Transfers;https://dl.acm.org/doi/fullHtml/10.1145/3411764.3445496;"SESSION: Health &amp; Behavior Change";kinaesthetics, learning, nursing care, tablet-based system
Does Clickbait Actually Attract More Clicks? Three Clickbait Studies You Must Read;https://dl.acm.org/doi/fullHtml/10.1145/3411764.3445753;"SESSION: Human, ML &amp; AI";clickbait, content perception, engagement, machine learning
Human Perceptions on Moral Responsibility of AI: A Case Study in AI-Assisted Bail Decision-Making;https://dl.acm.org/doi/fullHtml/10.1145/3411764.3445260;"SESSION: Human, ML &amp; AI";AI, Bail Decision-Making, Blame, COMPAS, Liability, Moral Judgment, Moral Responsibility, Responsibility
Towards Fairness in Practice: A Practitioner-Oriented Rubric for Evaluating Fair ML Toolkits;https://dl.acm.org/doi/fullHtml/10.1145/3411764.3445604;"SESSION: Human, ML &amp; AI";AI, ML, algorithmic bias, ethics, fairness, machine learning fairness, user-centric evaluation
Manipulating and Measuring Model Interpretability;https://dl.acm.org/doi/fullHtml/10.1145/3411764.3445315;"SESSION: Human, ML &amp; AI";human-centered machine learning, interpretability, machine-assisted decision making
Effects of Communication Directionality and AI Agent Differences in Human-AI Interaction;https://dl.acm.org/doi/fullHtml/10.1145/3411764.3445256;"SESSION: Human, ML &amp; AI";collaboration, games, human-AI interaction, social perception
Engaging Teachers to Co-Design Integrated AI Curriculum for K-12 Classrooms;https://dl.acm.org/doi/fullHtml/10.1145/3411764.3445377;"SESSION: Human, ML &amp; AI";Artificial Intelligence, Co-Design, K-12 Education
Towards Understanding Perceptual Differences between Genuine and Face-Swapped Videos;https://dl.acm.org/doi/fullHtml/10.1145/3411764.3445627;"SESSION: Human, ML &amp; AI";eye tracking, face swapping, human perception, video manipulation
Domestic Robots and the Dream of Automation: Understanding Human Interaction and Intervention;https://dl.acm.org/doi/fullHtml/10.1145/3411764.3445629;"SESSION: Human, ML &amp; AI";domestic robot automation, domestic robots, human-robot interaction, interventions to domestic robot breakdown
Designers Characterize Naturalness in Voice User Interfaces: Their Goals, Practices, and Challenges;https://dl.acm.org/doi/fullHtml/10.1145/3411764.3445579;"SESSION: Human, ML &amp; AI";challenges, characterize, designers, naturalness, practices, voice user interfaces (VUI)
Trade-offs for Substituting a Human with an Agent in a Pair Programming Context: The Good, the Bad, and the Ugly;https://dl.acm.org/doi/fullHtml/10.1145/3411764.3445659;"SESSION: Human, ML &amp; AI";Pair programming, avatars, conversational agents, empirical evaluation
What Do We See in Them? Identifying Dimensions of Partner Models for Speech Interfaces Using a Psycholexical Approach;https://dl.acm.org/doi/fullHtml/10.1145/3411764.3445206;"SESSION: Human, ML &amp; AI";human-machine dialogue, mental models, partner models, psycholexical, psychometrics, speech interfaces
Effect of Information Presentation on Fairness Perceptions of Machine Learning Predictors;https://dl.acm.org/doi/fullHtml/10.1145/3411764.3445365;"SESSION: Human, ML &amp; AI";AI, Artificial intelligence, ML., crowdsourcing, fairness, layperson, machine learning, predictor selection, transparency, visualisation
The Technology-Mediated Reflection Model: Barriers and Assistance in Data-Driven Reflection;https://dl.acm.org/doi/fullHtml/10.1145/3411764.3445505;"SESSION: Human, ML &amp; AI";construal, fitness trackers, personal informatics, reflection, tracking
AffectiveSpotlight: Facilitating the Communication of Affective Responses from Audience Members during Online Presentations;https://dl.acm.org/doi/fullHtml/10.1145/3411764.3445235;SESSION: Meetings, Chats, and Speech;Affective Computing, Intelligent User Interfaces, Public Speaking, Videoconferencing
Hidden Interaction Techniques: Concealed Information Acquisition and Texting on Smartphones and Wearables;https://dl.acm.org/doi/fullHtml/10.1145/3411764.3445504;SESSION: Meetings, Chats, and Speech;hidden interaction, interaction design, interaction techniques, mobile computing, smartphones, smartwatches, subtle interaction, ubiquitous computing
Tea, Earl Grey, Hot: Designing Speech Interactions from the Imagined Ideal of Star Trek;https://dl.acm.org/doi/fullHtml/10.1145/3411764.3445640;SESSION: Meetings, Chats, and Speech;Conversational analysis, Speech interaction design, Star Trek, Voice user interfaces
Firefox Voice: An Open and Extensible Voice Assistant Built Upon the Web;https://dl.acm.org/doi/fullHtml/10.1145/3411764.3445409;SESSION: Meetings, Chats, and Speech;CUI, browser extension, conversational user interface, open source, voice assistant
Acceptability of Speech and Silent Speech Input Methods in Private and Public;https://dl.acm.org/doi/fullHtml/10.1145/3411764.3445430;SESSION: Meetings, Chats, and Speech;contactless interaction, input and interaction, silent speech, social acceptance, speech, voice assistant
"MeetingCoach: An Intelligent Dashboard for Supporting Effective \&amp; Inclusive Meetings";https://dl.acm.org/doi/fullHtml/10.1145/3411764.3445615;SESSION: Meetings, Chats, and Speech;feedback, group, meeting, sensing, video-conferencing
Proxemics and Social Interactions in an Instrumented Virtual Reality Workshop;https://dl.acm.org/doi/fullHtml/10.1145/3411764.3445729;SESSION: Meetings, Chats, and Speech;Interviews., Social Signal Processing, Virtual Environments, Virtual Meetings
Eliciting and Analysing Users’ Envisioned Dialogues with Perfect Voice Assistants;https://dl.acm.org/doi/fullHtml/10.1145/3411764.3445536;SESSION: Meetings, Chats, and Speech;Adaptation, conversational agent, dialogue, personality, voice assistant
Experiencing Simulated Confrontations in Virtual Reality;https://dl.acm.org/doi/fullHtml/10.1145/3411764.3445401;SESSION: Meetings, Chats, and Speech;Virtual reality, confrontational behaviour, virtual character
Designing Conversational Agents: A Self-Determination Theory Approach;https://dl.acm.org/doi/fullHtml/10.1145/3411764.3445445;SESSION: Meetings, Chats, and Speech;Autonomy, Competence, Conversational Agents, Conversational User Experience, Relatedness
When the Social Becomes Non-Human: Young People's Perception of Social Support in Chatbots;https://dl.acm.org/doi/fullHtml/10.1145/3411764.3445318;SESSION: Meetings, Chats, and Speech;Artificial Intelligence, Chatbots, Social support, Young people
Tracing Conceptions of the Body in HCI: From User to More-Than-Human;https://dl.acm.org/doi/fullHtml/10.1145/3411764.3445656;SESSION: Design and Bodily Action;Embodied interaction design, body, embodiment, entanglement theories, feminism, fourth wave HCI, intersectionality, more-than-human, performance, phenomenology, posthuman, sensing
Understanding the Design Space of Embodied Passwords based on Muscle Memory;https://dl.acm.org/doi/fullHtml/10.1145/3411764.3445773;SESSION: Design and Bodily Action;Affordances, Authentication, Embodied Interaction, Explorative Research, Movement, Useable security
Designing Menstrual Technologies with Adolescents;https://dl.acm.org/doi/fullHtml/10.1145/3411764.3445471;SESSION: Design and Bodily Action;Feminist HCI, Menstrual Health, Participatory Design, Shape-changing Technologies, Soma Design
Azalea: Co-experience in Remote Dialog through Diminished Reality and Somaesthetic Interaction Design;https://dl.acm.org/doi/fullHtml/10.1145/3411764.3445052;SESSION: Design and Bodily Action;Somaesthetics, embodied information, embodiment, remote communication, smartphone sacrifice.
Dance and Choreography in HCI: A Two-Decade Retrospective;https://dl.acm.org/doi/fullHtml/10.1145/3411764.3445804;SESSION: Design and Bodily Action;choreography, creativity support, dance, movement quality, somaesthetics
Exploring Awareness of Breathing through Deep Touch Pressure;https://dl.acm.org/doi/fullHtml/10.1145/3411764.3445533;SESSION: Design and Bodily Action;Breathing, Deep Touch Pressure, Shape-Changing Interfaces, Soma Design, Wearables
Towards “Avatar-Friendly” 3D Manipulation Techniques: Bridging the Gap Between Sense of Embodiment and Interaction in Virtual Reality;https://dl.acm.org/doi/fullHtml/10.1145/3411764.3445379;SESSION: Design and Bodily Action;avatars, embodiment, guidelines, interaction, virtual reality
Interoceptive Interaction: An Embodied Metaphor Inspired Approach to Designing for Meditation;https://dl.acm.org/doi/fullHtml/10.1145/3411764.3445137;SESSION: Design and Bodily Action;Embodied metaphors, Haptics, Meditation technology, Thermal feedback
“Feeling the Sensor Feeling you”: A Soma Design Exploration on Sensing Non-habitual Breathing;https://dl.acm.org/doi/fullHtml/10.1145/3411764.3445628;SESSION: Design and Bodily Action;actuation, autobiographical design, breathing, non-habitual, sensing, shape-change, soma design
The Design Space of Wearables for Sports and Fitness Practices;https://dl.acm.org/doi/fullHtml/10.1145/3411764.3445700;SESSION: Design and Bodily Action;design space, fitness, movement, social wearables, sports, wearables
Articulating Soma Experiences using Trajectories;https://dl.acm.org/doi/fullHtml/10.1145/3411764.3445482;SESSION: Design and Bodily Action;Soma Design, Somaesthetics, Trajectories
Exploring Smartphone Relationships through Roland Barthes using an Instrumented Pillow Technology Probe;https://dl.acm.org/doi/fullHtml/10.1145/3411764.3445548;SESSION: Design and Bodily Action;literary language, smartphone addiction, technology probes
Understanding Blind Screen-Reader Users’ Experiences of Digital Artboards;https://dl.acm.org/doi/fullHtml/10.1145/3411764.3445242;SESSION: Accessible Content Creation;Computers and creativity, accessibility, art and design programs, blind and low-vision users., creativity applications, usability
ASL Sea Battle: Gamifying Sign Language Data Collection;https://dl.acm.org/doi/fullHtml/10.1145/3411764.3445416;SESSION: Accessible Content Creation;ASL, crowdsourcing, data, game, machine learning, sign language
What Makes Videos Accessible to Blind and Visually Impaired People?;https://dl.acm.org/doi/fullHtml/10.1145/3411764.3445233;SESSION: Accessible Content Creation;accessibility, blind, online videos, visual impairments
Detecting and Defending Against Seizure-Inducing GIFs in Social Media;https://dl.acm.org/doi/fullHtml/10.1145/3411764.3445510;SESSION: Accessible Content Creation;GIFs, accessibility, human-computer interaction, photosensitive epilepsy
Latte: Use-Case and Assistive-Service Driven Automated Accessibility Testing Framework for Android;https://dl.acm.org/doi/fullHtml/10.1145/3411764.3445455;SESSION: Accessible Content Creation;Accessibility, Automated Testing, Mobile Application
Screen Recognition: Creating Accessibility Metadata for Mobile Applications from Pixels;https://dl.acm.org/doi/fullHtml/10.1145/3411764.3445186;SESSION: Accessible Content Creation;accessibility enhancement, mobile accessibility, ui detection
Say It All: Feedback for Improving Non-Visual Presentation Accessibility;https://dl.acm.org/doi/fullHtml/10.1145/3411764.3445572;SESSION: Accessible Content Creation;Accessibility, Audio description, Presentation, Slides, Video
Toward Automatic Audio Description Generation for Accessible Videos;https://dl.acm.org/doi/fullHtml/10.1145/3411764.3445347;SESSION: Accessible Content Creation;accessibility, audio description, audio-visual consistency, sentence-level embedding, video captioning, video description
Technology Developments in Touch-Based Accessible Graphics: A Systematic Review of Research 2010-2020;https://dl.acm.org/doi/fullHtml/10.1145/3411764.3445207;SESSION: Accessible Content Creation;Assistive Technology, Blind, Low Vision, Systematic Literature Review, Tactile Graphics
Comparison of Methods for Evaluating Complexity of Simplified Texts among Deaf and Hard-of-Hearing Adults at Different Literacy Levels;https://dl.acm.org/doi/fullHtml/10.1145/3411764.3445038;SESSION: Accessible Content Creation;Accessibility, Automatic Text Simplification, Deaf and Hard-of-hearing, Methodological Research
TapeBlocks: A Making Toolkit for People Living with Intellectual Disabilities;https://dl.acm.org/doi/fullHtml/10.1145/3411764.3445647;SESSION: Accessible Content Creation;Making, accessibility, intellectual disability, tangibles
Optimal Action-based or User Prediction-based Haptic Guidance: Can You Do Even Better?;https://dl.acm.org/doi/fullHtml/10.1145/3411764.3445115;SESSION: Computational Physical Interaction;Deep learning, Haptic guidance, Physical human–robot interaction (pHRI), User adaptation
TapNet: The Design, Training, Implementation, and Applications of a Multi-Task Learning CNN for Off-Screen Mobile Input;https://dl.acm.org/doi/fullHtml/10.1145/3411764.3445626;SESSION: Computational Physical Interaction;Back-of-device, IMU, gesture recognition
FingerText: Exploring and Optimizing Performance for Wearable, Mobile and One-Handed Typing;https://dl.acm.org/doi/fullHtml/10.1145/3411764.3445106;SESSION: Computational Physical Interaction;head-mounted display, optimization, wearable input
A Computational Approach to Magnetic Force Feedback Design;https://dl.acm.org/doi/fullHtml/10.1145/3411764.3445631;SESSION: Computational Physical Interaction;Digital fabrication, Haptics, Inverse design, Magnetic force feedback, Optimization
A Probabilistic Interpretation of Motion Correlation Selection Techniques;https://dl.acm.org/doi/fullHtml/10.1145/3411764.3445184;SESSION: Computational Physical Interaction;computational interaction, gaze interaction, gestures, motion correlation, probabilistic input, pursuits
