Title;Link;Session;Keywords
LipType: A Silent Speech Recognizer Augmented with an Independent Repair Model;https://dl.acm.org/doi/fullHtml/10.1145/3411764.3445565;SESSION: Vision and Sensing;text input., language modeling, deep learning, Silent speech recognition
Auth+Track: Enabling Authentication Free Interaction on Smartphone by Continuous User Tracking;https://dl.acm.org/doi/fullHtml/10.1145/3411764.3445624;SESSION: Vision and Sensing;continuous user tracking, authentication model
ElectroRing: Subtle Pinch and Touch Detection with a Ring;https://dl.acm.org/doi/fullHtml/10.1145/3411764.3445094;SESSION: Vision and Sensing;touch detection, smart ring, mixed-reality
Project Tasca: Enabling Touch and Contextual Interactions with a Pocket-based Textile Sensor;https://dl.acm.org/doi/fullHtml/10.1145/3411764.3445712;SESSION: Vision and Sensing;wearables, resistive sensing, object recognition, interactive pockets, interactive fabrics, inductive sensing, gesture recognition, NFC, Capacitive sensing
RadarNet: Efficient Gesture Recognition Technique Utilizing a Miniature Radar Sensor;https://dl.acm.org/doi/fullHtml/10.1145/3411764.3445367;SESSION: Vision and Sensing;radar sensing, mobile, gesture recognition, deep learning
User Authentication via Electrical Muscle Stimulation;https://dl.acm.org/doi/fullHtml/10.1145/3411764.3445441;SESSION: Vision and Sensing;wearable, electrical muscle stimulation, biometric authentication
BackTrack: 2D Back-of-device Interaction Through Front Touchscreen;https://dl.acm.org/doi/fullHtml/10.1145/3411764.3445374;SESSION: Vision and Sensing;
ProxiMic: Convenient Voice Activation via Close-to-Mic Speech Detected by a Single Microphone;https://dl.acm.org/doi/fullHtml/10.1145/3411764.3445687;SESSION: Vision and Sensing;voice input, sensing technique, activity recognition
Pose-on-the-Go: Approximating User Pose with Smartphone Sensor Fusion and Inverse Kinematics;https://dl.acm.org/doi/fullHtml/10.1145/3411764.3445582;SESSION: Vision and Sensing;Smartphone, Motion tracking, Motion capture, Mobile, Body pose
FaceSight: Enabling Hand-to-Face Gesture Interaction on AR Glasses with a Downward-Facing Camera Vision;https://dl.acm.org/doi/fullHtml/10.1145/3411764.3445484;SESSION: Vision and Sensing;Hand-to-Face Gestures, Computer Vision, AR Glasses
AtaTouch: Robust Finger Pinch Detection for a VR Controller Using RF Return Loss;https://dl.acm.org/doi/fullHtml/10.1145/3411764.3445442;SESSION: Vision and Sensing;Virtual Reality (VR), Touch segmentation, RF Sensing, Hand gesture, Antenna
Super-Resolution Capacitive Touchscreens;https://dl.acm.org/doi/fullHtml/10.1145/3411764.3445703;SESSION: Vision and Sensing;Tracking, Touch input, Tangibles, Super-resolution, Capacitive sensing
RElectrode: A Reconfigurable Electrode For Multi-Purpose Sensing Based on Microfluidics;https://dl.acm.org/doi/fullHtml/10.1145/3411764.3445652;SESSION: Vision and Sensing;object recognition, microfluidics, gesture, capacitive and inductive sensing
Learning to Automate Chart Layout Configurations Using Crowdsourced Paired Comparison;https://dl.acm.org/doi/fullHtml/10.1145/3411764.3445179;SESSION: Designing Effective Visualizations;Visualization, Visual Design, Machine Learning, Image Quality Assessment, Crowdsourced
Data Animator: Authoring Expressive Animated Data Graphics;https://dl.acm.org/doi/fullHtml/10.1145/3411764.3445747;SESSION: Designing Effective Visualizations;staging, staggering, object matching, keyframing, authoring, animated data graphics
Leveraging Text-Chart Links to Support Authoring of Data-Driven Articles with VizFlow;https://dl.acm.org/doi/fullHtml/10.1145/3411764.3445354;SESSION: Designing Effective Visualizations;Text-Chart Links, Scrollytelling, Data-Driven Articles, Data Stories
Integrated Visualization Editing via Parameterized Declarative Templates;https://dl.acm.org/doi/fullHtml/10.1145/3411764.3445356;SESSION: Designing Effective Visualizations;User Interfaces, Templates, Systems, Ivy, Information Visualization, Declarative Grammars
Data Prophecy: Exploring the Effects of Belief Elicitation in Visual Analytics;https://dl.acm.org/doi/fullHtml/10.1145/3411764.3445798;SESSION: Designing Effective Visualizations;sensemaking, confirmatory analysis, Belief elicitation
ConceptScope: Organizing and Visualizing Knowledge in Documents based on Domain Ontology;https://dl.acm.org/doi/fullHtml/10.1145/3411764.3445396;SESSION: Designing Effective Visualizations;Visualization, Ontology, Knowledge Representation
Tessera: Discretizing Data Analysis Workflows on a Task Level;https://dl.acm.org/doi/fullHtml/10.1145/3411764.3445728;SESSION: Designing Effective Visualizations;Visualization, Interaction Log Analysis, Data Analytics
Modeling and Leveraging Analytic Focus During Exploratory Visual Analysis;https://dl.acm.org/doi/fullHtml/10.1145/3411764.3445674;SESSION: Designing Effective Visualizations;Visual Analytics, User Modeling, Insight Provenance, Analytic Focus
Showing Academic Performance Predictions during Term Planning: Effects on Students’ Decisions, Behaviors, and Preferences;https://dl.acm.org/doi/fullHtml/10.1145/3411764.3445718;SESSION: Designing Effective Visualizations;framing effects, course selection, course recommendation., academic performance predictions, Visual learning analytics
mTSeer: Interactive Visual Exploration of Models on Multivariate Time-series Forecast;https://dl.acm.org/doi/fullHtml/10.1145/3411764.3445083;SESSION: Designing Effective Visualizations;visualization, multivariate time series, model evaluation, machine learning, forecasting, feature extraction
CAST: Authoring Data-Driven Chart Animations;https://dl.acm.org/doi/fullHtml/10.1145/3411764.3445452;SESSION: Designing Effective Visualizations;interactive system, data visualization, chart animation specification, chart animation authoring, Chart animation
reVISit: Looking Under the Hood of Interactive Visualization Studies;https://dl.acm.org/doi/fullHtml/10.1145/3411764.3445382;SESSION: Designing Effective Visualizations;user studies, provenance, event sequences., evaluation methodology, Visualization
IGScript: An Interaction Grammar for Scientific Data Presentation;https://dl.acm.org/doi/fullHtml/10.1145/3411764.3445535;SESSION: Designing Effective Visualizations;scientific visualization, interaction grammar, data presentation
Tactile Fixations: A Behavioral Marker on How People with Visual Impairments Explore Raised-line Graphics;https://dl.acm.org/doi/fullHtml/10.1145/3411764.3445578;SESSION: Access for People with Visual Impairment;Visual impairment, Tactile Fixations, Raised-line graphic
Tactile Compass: Enabling Visually Impaired People to Follow a Path with Continuous Directional Feedback;https://dl.acm.org/doi/fullHtml/10.1145/3411764.3445644;SESSION: Access for People with Visual Impairment;tactile directional feedback, path-following tasks, accessibility
ThroughHand: 2D Tactile Interaction to Simultaneously Recognize and Touch Multiple Objects;https://dl.acm.org/doi/fullHtml/10.1145/3411764.3445530;SESSION: Access for People with Visual Impairment;Visual impairments, Shape-changing display, Real-time interaction, Haptics, Games, Accessibility
Exploring Technology Design for Students with Vision Impairment in the Classroom and Remotely;https://dl.acm.org/doi/fullHtml/10.1145/3411764.3445755;SESSION: Access for People with Visual Impairment;visually impaired, teachers, classroom, children, blind, Accessibility
Community Based Robot Design for Classrooms with Mixed Visual Abilities Children;https://dl.acm.org/doi/fullHtml/10.1145/3411764.3445135;SESSION: Access for People with Visual Impairment;visual impairment, social robots, participatory design, inclusion
LightWrite: Teach Handwriting to The Visually Impaired with A Smartphone;https://dl.acm.org/doi/fullHtml/10.1145/3411764.3445322;SESSION: Access for People with Visual Impairment;Handwriting Learning, Blind and Visually-Impaired Users, Accessibility
LineChaser: A Smartphone-Based Navigation System for Blind People to Stand in Lines;https://dl.acm.org/doi/fullHtml/10.1145/3411764.3445451;SESSION: Access for People with Visual Impairment;visual impairment, pedestrian detection, orientation and mobility, line detection
Smartphone Usage by Expert Blind Users;https://dl.acm.org/doi/fullHtml/10.1145/3411764.3445074;SESSION: Access for People with Visual Impairment;vision impairment, usage pattern, touchscreen, text entry, smartphone, security, gestures, expert users., blind users, app usage, accessibility, TalkBack, TTS
Examining Visual Semantic Understanding in Blind and Low-Vision Technology Users;https://dl.acm.org/doi/fullHtml/10.1145/3411764.3445040;SESSION: Access for People with Visual Impairment;visual design, blind and low-vision creators, Accessibility
From Tactile to NavTile: Opportunities and Challenges with Multi-Modal Feedback for Guiding Surfaces during Non-Visual Navigation;https://dl.acm.org/doi/fullHtml/10.1145/3411764.3445716;SESSION: Access for People with Visual Impairment;Textured Surface, Tactile, Navigation, Mobility, Low-Vision, Blind
Voicemoji: Emoji Entry Using Voice for Visually Impaired People;https://dl.acm.org/doi/fullHtml/10.1145/3411764.3445338;SESSION: Access for People with Visual Impairment;visual impairments., speech user interfaces, blind or low vision users, accessibility, Voice-based emoji input
Money Whispers: Informality, International Politics, and Immigration in Transnational Finance;https://dl.acm.org/doi/fullHtml/10.1145/3411764.3445065;SESSION: Tech for Specific Situations;Remittance, Money Transfer, Migration, International Politics, Informality, FinTech, Currency Exchange
“Everyone wants to do the model work, not the data work”: Data Cascades in High-Stakes AI;https://dl.acm.org/doi/fullHtml/10.1145/3411764.3445518;SESSION: Tech for Specific Situations;raters, high-stakes AI, developers, data quality, data politics, data collectors, data cascades, application-domain experts, Uganda, USA, Nigeria, ML, Kenya, India, Ghana, Data, AI
Head-Worn Displays for Emergency Medical Services Staff: Properties of Prehospital Work, Use Cases, and Design Considerations;https://dl.acm.org/doi/fullHtml/10.1145/3411764.3445614;SESSION: Tech for Specific Situations;Smart glasses, Head-worn display, Emergency medical services
“We Just Use What They Give Us”: Understanding Passenger User Perspectives in Smart Homes;https://dl.acm.org/doi/fullHtml/10.1145/3411764.3445598;SESSION: Tech for Specific Situations;user experience, smart homes, pilot users, passenger users, mixed-methods study, internet of things, domestication theory
Exploring the Use of a Voice-based Conversational Agent to Empower Adolescents with Autism Spectrum Disorder;https://dl.acm.org/doi/fullHtml/10.1145/3411764.3445116;SESSION: Tech for Specific Situations;Voice-based Conversational Agent, Participatory Design Workshop, Adolescents with Autism Spectrum Disorder
Teachers’ Perceptions around Digital Games for Children in Low-resource Schools for the Blind;https://dl.acm.org/doi/fullHtml/10.1145/3411764.3445194;SESSION: Tech for Specific Situations;Visual Impairment, Teachers, India, Digital Games, Children, Accessibility.
”Beyond 3D printers”: Understanding Long-Term Digital Fabrication Practices for the Education of Visually Impaired or Blind Youth;https://dl.acm.org/doi/fullHtml/10.1145/3411764.3445403;SESSION: Tech for Specific Situations;Workplace, Tactile, Social Design, School, Making, Maker Space, Inclusive Innovation, Fablab, Do-It-Yourself, Disability, Activity Theory, 3D Printing
Rethinking the Runway: Using Avant-Garde Fashion To Design a System for Wearables;https://dl.acm.org/doi/fullHtml/10.1145/3411764.3445643;SESSION: Tech for Specific Situations;modular, haute couture, hardware, fashion-tech, avant-garde, Wearables
“Money makes the world go around”: Identifying Barriers to Better Privacy in Children’s Apps From Developers’ Perspectives;https://dl.acm.org/doi/fullHtml/10.1145/3411764.3445599;SESSION: Tech for Specific Situations;developer values, developer practices, children’s privacy, children’s apps, age-appropriate design
The Complexity of Indoor Air Quality Forecasting and the Simplicity of Interacting with It – A Case Study of 1007 Office Meetings;https://dl.acm.org/doi/fullHtml/10.1145/3411764.3445524;SESSION: Tech for Specific Situations;Office Meeting, Interaction with Predictive Models, Indoor Air Quality, Human-Building Interaction
Financial Technologies in the Cycle of Poor Mental Health and Financial Hardship: Towards Financial Citizenship;https://dl.acm.org/doi/fullHtml/10.1145/3411764.3445251;SESSION: Tech for Specific Situations;Mental health, Financial technology, Financial inclusion, Financial hardship, Financial citizenship, Diary study
A Right Time to Give: Beyond Saving Time in Automated Conditional Donations;https://dl.acm.org/doi/fullHtml/10.1145/3411764.3445371;SESSION: Tech for Specific Situations;
Making Sense of Complex Running Metrics Using a Modified Running Shoe;https://dl.acm.org/doi/fullHtml/10.1145/3411764.3445506;SESSION: Tech for Specific Situations;running, body sensing, Runscribe, HCI for sports
Seeing Beyond Expert Blind Spots: Online Learning Design for Scale and Quality;https://dl.acm.org/doi/fullHtml/10.1145/3411764.3445045;SESSION: Education;"multiple-choice questions, matched assessment comparison, learning@scale;learning experience design, instructor belief, HCI education"
Breaking out of the Lab: Mitigating Mind Wandering with Gaze-Based Attention-Aware Technology in Classrooms;https://dl.acm.org/doi/fullHtml/10.1145/3411764.3445269;SESSION: Education;mind wandering, intelligent tutoring systems, eye-gaze, cyberlearning, attention-aware learning
Improving Instruction of Programming Patterns with Faded Parsons Problems;https://dl.acm.org/doi/fullHtml/10.1145/3411764.3445228;SESSION: Education;Programming Patterns, Parsons Problems, Computing Education, CS1
StoryCoder: Teaching Computational Thinking Concepts Through Storytelling in a Voice-Guided App for Children;https://dl.acm.org/doi/fullHtml/10.1145/3411764.3445039;SESSION: Education;voice user interface, storytelling, computational thinking, children
On Designing Programming Error Messages for Novices: Readability and its Constituent Factors;https://dl.acm.org/doi/fullHtml/10.1145/3411764.3445696;SESSION: Education;students, readability, programming error messages, novice programmers, introductory programming, human computer interaction, compiler error messages, compiler design and implementation, HCI, CS1
The Role of Working Memory in Program Tracing;https://dl.acm.org/doi/fullHtml/10.1145/3411764.3445257;SESSION: Education;working memory, restricted focus viewing, program comprehension, Program tracing
Diagramming Working Field Theories for Design in the HCI Classroom;https://dl.acm.org/doi/fullHtml/10.1145/3411764.3445414;SESSION: Education;visual thinking, sensitizing concept, fieldwork, design research, HCI education
Effective Interfaces for Student-Driven Revision Sessions for Argumentative Writing;https://dl.acm.org/doi/fullHtml/10.1145/3411764.3445683;SESSION: Education;wizard of oz, revision, intelligent interface, argumentative writing, Academic writing
EvalMe: Exploring the Value of New Technologies for In Situ Evaluation of Learning Experiences;https://dl.acm.org/doi/fullHtml/10.1145/3411764.3445749;SESSION: Education;Tangible, Schools, Educational Setting, Education/learning, Children/Parents
Problem-Solving Efficiency and Cognitive Load for Adaptive Parsons Problems vs. Writing the Equivalent Code;https://dl.acm.org/doi/fullHtml/10.1145/3411764.3445292;SESSION: Education;Programming, Parsons Problems, Computing Education, Cognitive Load Theory
Avoiding the Turing Tarpit: Learning Conversational Programming by Starting from Code’s Purpose;https://dl.acm.org/doi/fullHtml/10.1145/3411764.3445571;SESSION: Education;scaffolding, programming plans, motivation, conversational programmers, computer-supported instruction
“You Gotta Watch What You Say”: Surveillance of Communication with Incarcerated People;https://dl.acm.org/doi/fullHtml/10.1145/3411764.3445055;SESSION: Privacy Design;surveillance, privacy, prison, communication, ICT
Toggles, Dollar Signs, and Triangles: How to (In)Effectively Convey Privacy Choices with Icons and Link Texts;https://dl.acm.org/doi/fullHtml/10.1145/3411764.3445387;SESSION: Privacy Design;icon design, choice, Privacy, CCPA.
A Design Space for Privacy Choices: Towards Meaningful Privacy Control in the Internet of Things;https://dl.acm.org/doi/fullHtml/10.1145/3411764.3445148;SESSION: Privacy Design;usable privacy, privacy choice, design space, Internet of Things
Us and Them (and It): Social Orientation, Privacy Concerns, and Expected Use of Pandemic-Tracking Apps in the United States;https://dl.acm.org/doi/fullHtml/10.1145/3411764.3445485;SESSION: Privacy Design;surveillance, social orientation, social framing, social contract, smartphone apps, privacy, pandemic, mobile apps, individualism, contact tracing, collectivism, MUIPC, IND-COL, COVID-19
Visual Interactive Privacy Policy: The Better Choice?;https://dl.acm.org/doi/fullHtml/10.1145/3411764.3445465;SESSION: Privacy Design;Privacy Policy Nutrition Label, Privacy Policy, Privacy
Bolder is Better: Raising User Awareness through Salient and Concise Privacy Notices;https://dl.acm.org/doi/fullHtml/10.1145/3411764.3445516;SESSION: Privacy Design;privacy communication, privacy awareness, information systems, information saliency, experimental design, Privacy notices
Exploring Design and Governance Challenges in the Development of Privacy-Preserving Computation;https://dl.acm.org/doi/fullHtml/10.1145/3411764.3445677;SESSION: Privacy Design;privacy-enhancing technologies, policy, expert interview, cryptography
PriView– Exploring Visualisations to Support Users’ Privacy Awareness;https://dl.acm.org/doi/fullHtml/10.1145/3411764.3445067;SESSION: Privacy Design;Visualisation, VR, Thermal Camera, Smart Home, Smart Environments, Smart Devices, Privacy, Mobile Application, IoT, AR
Apps Against the Spread: Privacy Implications and User Acceptance of COVID-19-Related Smartphone Apps on Three Continents;https://dl.acm.org/doi/fullHtml/10.1145/3411764.3445517;SESSION: Privacy Design;privacy, digital contact tracing, COVID-19
A Digital Safety Dilemma: Analysis of Computer-Mediated Computer Security Interventions for Intimate Partner Violence During COVID-19;https://dl.acm.org/doi/fullHtml/10.1145/3411764.3445589;SESSION: Privacy Design;intimate partner violence, gender-based violence, computer security and privacy
Assessing the Impact of Automated Suggestions on Decision Making: Domain Experts Mediate Model Errors but Take Less Initiative;https://dl.acm.org/doi/fullHtml/10.1145/3411764.3445522;SESSION: Computational AI Development and Explanation;text tagging, ontology, mental model, human-AI teams, clinical annotation, agency
EventAnchor: Reducing Human Interactions in Event Annotation of Racket Sports Videos;https://dl.acm.org/doi/fullHtml/10.1145/3411764.3445431;SESSION: Computational AI Development and Explanation;visualization, data annotation, computer vision, Racket sports
Beyond Expertise and Roles: A Framework to Characterize the Stakeholders of Interpretable Machine Learning and their Needs;https://dl.acm.org/doi/fullHtml/10.1145/3411764.3445088;SESSION: Computational AI Development and Explanation;needs, machine learning, knowledge, interpretability, goals, framework, explainability, expertise
Data-Centric Explanations: Explaining Training Data of Machine Learning Systems to Promote Transparency;https://dl.acm.org/doi/fullHtml/10.1145/3411764.3445736;SESSION: Computational AI Development and Explanation;User Expertise, Trust, Transparency, Training Data, Machine Learning Systems, Fairness, Explanations
Method for Exploring Generative Adversarial Networks (GANs) via Automatically Generated Image Galleries;https://dl.acm.org/doi/fullHtml/10.1145/3411764.3445714;SESSION: Computational AI Development and Explanation;qualitative model validation., Interactive model exploration
Player-AI Interaction: What Neural Network Games Reveal About AI as Play;https://dl.acm.org/doi/fullHtml/10.1145/3411764.3445307;SESSION: Computational AI Development and Explanation;User Experience, Neural Networks, Human-AI Interaction, Game Design
Human Reliance on Machine Learning Models When Performance Feedback is Limited: Heuristics and Risks;https://dl.acm.org/doi/fullHtml/10.1145/3411764.3445562;SESSION: Computational AI Development and Explanation;human-AI interaction, appropriate reliance, Machine learning
AutoDS: Towards Human-Centered Automation of Data Science;https://dl.acm.org/doi/fullHtml/10.1145/3411764.3445526;SESSION: Computational AI Development and Explanation;model building, human-in-the-loop, human-AI collaboration, collaborative AI, automated machine learning, automated data science, XAI, Data science, AutoML, AutoDS, AI
Evaluating the Interpretability of Generative Models by Interactive Reconstruction;https://dl.acm.org/doi/fullHtml/10.1145/3411764.3445296;SESSION: Computational AI Development and Explanation;representation learning, interpretability, evaluation methods
Does the Whole Exceed its Parts? The Effect of AI Explanations on Complementary Team Performance;https://dl.acm.org/doi/fullHtml/10.1145/3411764.3445717;SESSION: Computational AI Development and Explanation;Human-AI teams, Explainable AI, Augmented intelligence
Expanding Explainability: Towards Social Transparency in AI systems;https://dl.acm.org/doi/fullHtml/10.1145/3411764.3445188;SESSION: Computational AI Development and Explanation;sociotechnical, socio-organizational context, social transparency, human-AI interaction, explanations, Explainable AI, Artificial Intelligence
Whither AutoML? Understanding the Role of Automation in Machine Learning Workflows;https://dl.acm.org/doi/fullHtml/10.1145/3411764.3445306;SESSION: Computational AI Development and Explanation;
Circumspect Users: Older Adults as Critical Adopters and Resistors of Technology;https://dl.acm.org/doi/fullHtml/10.1145/3411764.3445128;SESSION: Technology Resistance/HCI and Distinct Populations/Queering Technologies;Older adults, Life story interview, Life course, Everyday resistance
Buying the ‘Right’ Thing: Designing Food Recommender Systems with Critical Consumers;https://dl.acm.org/doi/fullHtml/10.1145/3411764.3445264;SESSION: Technology Resistance/HCI and Distinct Populations/Queering Technologies;recommender systems, food, ethics, critical consumerism, consumer informatics, co-design
Training and Embedding Cybersecurity Guardians in Older Communities.;https://dl.acm.org/doi/fullHtml/10.1145/3411764.3445078;SESSION: Technology Resistance/HCI and Distinct Populations/Queering Technologies;information sharing, cybersecurity, community, civic engagement, Older adults
What Makes Civic Tech Initiatives To Last Over Time? Dissecting Two Global Cases;https://dl.acm.org/doi/fullHtml/10.1145/3411764.3445667;SESSION: Technology Resistance/HCI and Distinct Populations/Queering Technologies;Sustainability, Scaling, Digital Civics, Civic Tech, Civic IoT, Citizen Science
Applying Critical Voice in Design of User Interfaces for Supporting Self-Reflection and Emotion Regulation in Online News Commenting;https://dl.acm.org/doi/fullHtml/10.1145/3411764.3445783;SESSION: Technology Resistance/HCI and Distinct Populations/Queering Technologies;Social Media, Online News, Expert interviews, Emotional reflection, Digital Media, Design conventions, Design Research, Design Fiction, Critique, Critical Design
Chasing Luck: Data-driven Prediction, Faith, Hunch, and Cultural Norms in Rural Betting Practices;https://dl.acm.org/doi/fullHtml/10.1145/3411764.3445047;SESSION: Technology Resistance/HCI and Distinct Populations/Queering Technologies;Rural HCI, Prediction, Luck, Hunch, Faith, Data-driven, Betting, Bangladesh, Alternative rationalities
" 'We Can Send A Man To The Moon But We Can't Control The Temperature In Our office'; A Considerate Approach To Workplace Thermal Comfort by Older Women";https://dl.acm.org/doi/fullHtml/10.1145/3411764.3445127;SESSION: Technology Resistance/HCI and Distinct Populations/Queering Technologies;User experience, Thermal comfort, Menopause 4, Gender, 3, 2, 1
Gospels of Modernity: Digital Cattle Markets, Urban Religiosity, and Secular Computing in the Global South;https://dl.acm.org/doi/fullHtml/10.1145/3411764.3445259;SESSION: Technology Resistance/HCI and Distinct Populations/Queering Technologies;Urban Design, Spatial Politics, Secular Computing, Modernity, Digital Marketplace
Provocations from #vanlife: Investigating Life and Work in a Community Extensively Using Technology Not Designed for Them;https://dl.acm.org/doi/fullHtml/10.1145/3411764.3445393;SESSION: Technology Resistance/HCI and Distinct Populations/Queering Technologies;work technology, vanlife, field study, domestichi, domestic technology
Using Design Fiction Memos to Analyze UX Professionals’ Values Work Practices: A Case Study Bridging Ethnographic and Design Futuring Methods;https://dl.acm.org/doi/fullHtml/10.1145/3411764.3445709;SESSION: Technology Resistance/HCI and Distinct Populations/Queering Technologies;values work, values in design, values, ethnography, ethics, design fiction, UX professionals, UX practice
Designing Ground Truth and the Social Life of Labels;https://dl.acm.org/doi/fullHtml/10.1145/3411764.3445402;SESSION: Technology Resistance/HCI and Distinct Populations/Queering Technologies;human centered machine learning, Human centered data science, Critical computing
To Live in Their Utopia: Why Algorithmic Systems Create Absurd Outcomes;https://dl.acm.org/doi/fullHtml/10.1145/3411764.3445740;SESSION: Technology Resistance/HCI and Distinct Populations/Queering Technologies;Street-Level Algorithms, HCI, Artificial Intelligence
