Title;Link;Session;Keywords
Your Photo is so Funny that I don’t Mind Violating Your Privacy by Sharing it: Effects of Individual Humor Styles on Online Photo-sharing Behaviors;https://dl.acm.org/doi/fullHtml/10.1145/3411764.3445258;SESSION: Privacy Behaviors;privacy, photo-sharing, online social media, intervention, humor, decision-making
Truth or Dare: Understanding and Predicting How Users Lie and Provide Untruthful Data Online;https://dl.acm.org/doi/fullHtml/10.1145/3411764.3445625;SESSION: Privacy Behaviors;Untruthful data, Privacy lies, Privacy Protective Behaviors, False Information
Privacy Norms for Smart Home Personal Assistants;https://dl.acm.org/doi/fullHtml/10.1145/3411764.3445122;SESSION: Privacy Behaviors;Voice Assistants, Smart Home Personal Assistants, Privacy, Norms, Google Assistant, Contextual Integrity, Amazon Alexa, AI Assistants
The Annoying, the Disturbing, and the Weird: Challenges with Phone Numbers as Identifiers and Phone Number Recycling;https://dl.acm.org/doi/fullHtml/10.1145/3411764.3445085;SESSION: Privacy Behaviors;user identification, security, phone numbers, phone number recycling., Privacy
Tag a Teacher: A Qualitative Analysis of WhatsApp-Based Teacher Networks in Low-Income Indian Schools;https://dl.acm.org/doi/fullHtml/10.1145/3411764.3445221;SESSION: Various People;whatsapp, teacher networks, teacher development, cooperative work, ICTD, HCI4D, Education
Sustaining a Networked Community Resource: Findings from a Longitudinal Situated Display Deployment;https://dl.acm.org/doi/fullHtml/10.1145/3411764.3445693;SESSION: Various People;social inclusion, rural community, pervasive displays, community resource
Examining the Use of Online Platforms for Employment: A Survey of U.S. Job Seekers;https://dl.acm.org/doi/fullHtml/10.1145/3411764.3445350;SESSION: Various People;social media, job seekers, internet, Socio-demographic factors, Employment
“Disadvantaged in the American-dominated Internet”: Sex, Work, and Technology;https://dl.acm.org/doi/fullHtml/10.1145/3411764.3445378;SESSION: Various People;work, technology, sex work, sex, qualitative, marginalized population, interview, harassment, discrimination, digital workplace
Ask Me or Tell Me? Enhancing the Effectiveness of Crowdsourced Design Feedback;https://dl.acm.org/doi/fullHtml/10.1145/3411764.3445507;SESSION: Various People;sentiment, questioning, feedback framing, crowdsourced design feedback
Galileo: Citizen-led Experimentation Using a Social Computing System;https://dl.acm.org/doi/fullHtml/10.1145/3411764.3445668;SESSION: Various People;experimentation, crowdsourcing, citizen science, Social computing systems
Human-Nature Relations in Urban Gardens: Explorations with Camera Traps;https://dl.acm.org/doi/fullHtml/10.1145/3411764.3445438;SESSION: Various People;Urban Biodiversity, More-than-Human, Human Computer Interaction, Gardening, Citizen Sensing, Care, Cameras
"Engaging with Nature Sounds \&amp; Citizen Science by Designing for Creative \&amp; Contextual Audio Encounters";https://dl.acm.org/doi/fullHtml/10.1145/3411764.3445390;SESSION: Various People;Wildlife, Sound, Participatory Design, Nature, Ludic Design, Learning, Games with a Purpose, Games, Emotion, Creativity, Citizen Science, Birds, Audio, Agent
Exploring a Makeup Support System for Transgender Passing based on Automatic Gender Recognition;https://dl.acm.org/doi/fullHtml/10.1145/3411764.3445364;SESSION: Various People;transgender, machine learning, inclusivity, gender, Automatic Gender Recognition
Karamad: A Voice-based Crowdsourcing Platform for Underserved Populations;https://dl.acm.org/doi/fullHtml/10.1145/3411764.3445417;SESSION: Various People;voice, underserved, telephonic surveys, telephone, speech, mobile phone, low-literate, income, crowdsourcing, crowd work, cellphone., Pakistan, Interactive Voice Response, IVR, ICT4D, HCI4D
Hardhats and Bungaloos: Comparing Crowdsourced Design Feedback with Peer Design Feedback in the Classroom;https://dl.acm.org/doi/fullHtml/10.1145/3411764.3445380;SESSION: Various People;peer review, design feedback, crowdsourcing, crowd feedback system, classroom study
Breakdowns and Breakthroughs: Observing Musicians’ Responses to the COVID-19 Pandemic;https://dl.acm.org/doi/fullHtml/10.1145/3411764.3445192;SESSION: Various People;remote collaboration, life disruption, creativity support tools, COVID-19
CakeVR: A Social Virtual Reality (VR) Tool for Co-designing Cakes;https://dl.acm.org/doi/fullHtml/10.1145/3411764.3445503;SESSION: Various People;Social Virtual Reality, Remote Collaboration, Co-design, Cake Design
Adapting User Interfaces with Model-based Reinforcement Learning;https://dl.acm.org/doi/fullHtml/10.1145/3411764.3445497;SESSION: Computational Design;Reinforcement Learning, Predictive Models, Monte Carlo Tree Search, Adaptive User Interfaces
VisiFit: Structuring Iterative Improvement for Novice Designers;https://dl.acm.org/doi/fullHtml/10.1145/3411764.3445089;SESSION: Computational Design;Iterative design, Design tools, Computational design
Investigating the Homogenization of Web Design: A Mixed-Methods Approach;https://dl.acm.org/doi/fullHtml/10.1145/3411764.3445156;SESSION: Computational Design;web design, interviews, historical analysis, design homogenization, computational social science
FashionQ: An AI-Driven Creativity Support Tool for Facilitating Ideation in Fashion Design;https://dl.acm.org/doi/fullHtml/10.1145/3411764.3445093;SESSION: Computational Design;ideation process, fashion design, creativity support tool, cognitive operation, artificial intelligence utilization
Vinci: An Intelligent Graphic Design System for Generating Advertising Posters;https://dl.acm.org/doi/fullHtml/10.1145/3411764.3445117;SESSION: Computational Design;design tool, deep generative networks, Graphic design
Screen2Vec: Semantic Embedding of GUI Screens and GUI Components;https://dl.acm.org/doi/fullHtml/10.1145/3411764.3445049;SESSION: Computational Design;screen semantics, interaction mining, GUI embedding
“Warm Bodies”: A Post-Processing Technique for Animating Dynamic Blood Flow on Photos and Avatars;https://dl.acm.org/doi/fullHtml/10.1145/3411764.3445719;SESSION: Computational Design;photoplethysmography, perfusion, embodied agents, blood flow
Virtual Camera Layout Generation using a Reference Video;https://dl.acm.org/doi/fullHtml/10.1145/3411764.3445437;SESSION: Computational Design;Virtual Camera, Content Analysis, Cinematography
AdverTiming Matters: Examining User Ad Consumption for Effective Ad Allocations on Social Media;https://dl.acm.org/doi/fullHtml/10.1145/3411764.3445394;SESSION: Computational Design;social media, momentary behaviors, causal-inference, ads, Snapchat
AI as Social Glue: Uncovering the Roles of Deep Generative AI during Social Music Composition;https://dl.acm.org/doi/fullHtml/10.1145/3411764.3445219;SESSION: Computational Design;music composition, machine learning, human-AI co-creation
The Effects of Warmth and Competence Perceptions on Users' Choice of an AI System;https://dl.acm.org/doi/fullHtml/10.1145/3411764.3446863;SESSION: Computational Design;Warmth, Competence, Artificial intelligence
Design and Analysis of Intelligent Text Entry Systems with Function Structure Models and Envelope Analysis;https://dl.acm.org/doi/fullHtml/10.1145/3411764.3445566;SESSION: Computational Design;text entry design, predictive text entry, engineering design, computational modeling, computational interaction
AdaptiFont: Increasing Individuals’ Reading Speed with a Generative Font Model and Bayesian Optimization;https://dl.acm.org/doi/fullHtml/10.1145/3411764.3445140;SESSION: Computational Design;reading speed, generative model, adaptive font, Bayesian optimization
Optimization-based User Support for Cinematographic Quadrotor Camera Target Framing;https://dl.acm.org/doi/fullHtml/10.1145/3411764.3445568;SESSION: Computational Design;Trajectory Optimization, Quadrotor Camera Tools, Computational Design, Aerial Videography
Reward Seeking or Loss Aversion? Impact of Regulatory Focus Theory on Emotional Induction in Children and Their Behavior Towards a Social Robot;https://dl.acm.org/doi/fullHtml/10.1145/3411764.3445486;SESSION: Computational Design;social robotics, social engagement, regulatory focus, human robot interaction, emotional induction
Market, Testbed, Backroom: The Redacted Internet of Facebook’s Discover;https://dl.acm.org/doi/fullHtml/10.1145/3411764.3445754;SESSION: Justice / Critical Reflections on the Field / The Art of Making;the Philippines, political economy, document theory, access, Connectivity
Modeling Assumptions Clash with the Real World: Transparency, Equity, and Community Challenges for Student Assignment Algorithms;https://dl.acm.org/doi/fullHtml/10.1145/3411764.3445748;SESSION: Justice / Critical Reflections on the Field / The Art of Making;value sensitive design, student assignment, mechanism design
Beyond Kant and Bentham: How Ethical Theories are being used in Artificial Moral Agents;https://dl.acm.org/doi/fullHtml/10.1145/3411764.3445102;SESSION: Justice / Critical Reflections on the Field / The Art of Making;Virtue Ethics, Philosophy, Literature Survey, Deontology, Consequentialism, Confucianism, Artificial Moral Agents, Additional Keywords and Phrases Ethics
Perspectives of Bioartists and Community Lab Organizers on Working with Living Organisms;https://dl.acm.org/doi/fullHtml/10.1145/3411764.3445060;SESSION: Justice / Critical Reflections on the Field / The Art of Making;transgenic art, community science, biotechnology, bioart, Living organisms, DIYbio
“Turning the Invisible Visible”: Transdisciplinary Bioart Explorations in Human-DNA Interaction;https://dl.acm.org/doi/fullHtml/10.1145/3411764.3445408;SESSION: Justice / Critical Reflections on the Field / The Art of Making;transgenic art, synthetic biology, community science, biotechnology, bioart, Living organisms, DIYbio
Studying the Formation of an Older Adult-Led Makerspace;https://dl.acm.org/doi/fullHtml/10.1145/3411764.3445146;SESSION: Justice / Critical Reflections on the Field / The Art of Making;Values, Older Adults, Makerspaces, Maker, DIY, Community, Aging
Tools, Tricks, and Hacks: Exploring Novel Digital Fabrication Workflows on #PlotterTwitter;https://dl.acm.org/doi/fullHtml/10.1145/3411764.3445653;SESSION: Justice / Critical Reflections on the Field / The Art of Making;maker culture, fabrication
Techniques of Use: Confronting Value Systems of Productivity, Progress, and Usefulness in Computing and Design;https://dl.acm.org/doi/fullHtml/10.1145/3411764.3445237;SESSION: Justice / Critical Reflections on the Field / The Art of Making;violence, usefulness, racism, progress, productivity, paternalism, labor, injustice, genealogy, exploitation, colonialism
Biographies of Biometric Devices: The POS Machine at Work in India's PDS;https://dl.acm.org/doi/fullHtml/10.1145/3411764.3445553;SESSION: Justice / Critical Reflections on the Field / The Art of Making;Infrastructure, Food security, Biometrics, Aadhaar
Opening Research Commissioning To Civic Participation: Creating A Community Panel To Review The Social Impact of HCI Research Proposals;https://dl.acm.org/doi/fullHtml/10.1145/3411764.3445113;SESSION: Justice / Critical Reflections on the Field / The Art of Making;participation, design, commissioning, Social justice HCI, HCI research
AI in Global Health: The View from the Front Lines;https://dl.acm.org/doi/fullHtml/10.1145/3411764.3445130;SESSION: Justice / Critical Reflections on the Field / The Art of Making;Social Good, Qualitative, India, Healthcare, HCI4D, AI
A Critical Examination of Virtual Reality Technology in the Context of the Minority Body;https://dl.acm.org/doi/fullHtml/10.1145/3411764.3445196;SESSION: Justice / Critical Reflections on the Field / The Art of Making;Surrogate Body Theory, Disability Studies
User Ex Machina : Simulation as a Design Probe in Human-in-the-Loop Text Analytics;https://dl.acm.org/doi/fullHtml/10.1145/3411764.3445425;SESSION: Understanding Visualizations;unsupervised clustering, topic modelling, text analytics, human-in-the-loop ML
Fits and Starts: Enterprise Use of AutoML and the Role of Humans in the Loop;https://dl.acm.org/doi/fullHtml/10.1145/3411764.3445775;SESSION: Understanding Visualizations;Machine Learning, Data Scientists, Data Science, Automation
Vis Ex Machina: An Analysis of Trust in Human versus Algorithmically Generated Visualization Recommendations;https://dl.acm.org/doi/fullHtml/10.1145/3411764.3445195;SESSION: Understanding Visualizations;recommendation source, automation, algorithmic trust, Visualization recommendation systems
Causal Perception in Question-Answering Systems;https://dl.acm.org/doi/fullHtml/10.1145/3411764.3445444;SESSION: Understanding Visualizations;question answering, correlation and causation
Understanding Narrative Linearity for Telling Expressive Time-Oriented Stories;https://dl.acm.org/doi/fullHtml/10.1145/3411764.3445344;SESSION: Understanding Visualizations;Storytelling, Narrative Visualization, Narrative Order
Communicating with Motion: A Design Space for Animated Visual Narratives in Data Videos;https://dl.acm.org/doi/fullHtml/10.1145/3411764.3445337;SESSION: Understanding Visualizations;Visual Narratives, Narrative Visualization, Data Videos, Animation
Understanding Data Accessibility for People with Intellectual and Developmental Disabilities;https://dl.acm.org/doi/fullHtml/10.1145/3411764.3445743;SESSION: Understanding Visualizations;"human-subjects quantitative studies, graphical perception \&amp; cognition"
Viral Visualizations: How Coronavirus Skeptics Use Orthodox Data Practices to Promote Unorthodox Science Online;https://dl.acm.org/doi/fullHtml/10.1145/3411764.3445211;SESSION: Understanding Visualizations;network analysis, digital ethnography, data visualization, data literacy, Twitter, Facebook
Mapping the Landscape of COVID-19 Crisis Visualizations;https://dl.acm.org/doi/fullHtml/10.1145/3411764.3445381;SESSION: Understanding Visualizations;crisis informatics, Visualization, COVID-19
Does Interaction Improve Bayesian Reasoning with Visualization?;https://dl.acm.org/doi/fullHtml/10.1145/3411764.3445176;SESSION: Understanding Visualizations;Reasoning, Problem Solving, Interaction Design, Human-Subjects Quantitative Studies, Decision Making, Data Analysis
Towards Understanding How Readers Integrate Charts and Captions: A Case Study with Line Charts;https://dl.acm.org/doi/fullHtml/10.1145/3411764.3445443;SESSION: Understanding Visualizations;visually prominent features, takeaways., line charts, Captions
Can Anthropographics Promote Prosociality?A Review and Large-Sample Study;https://dl.acm.org/doi/fullHtml/10.1145/3411764.3445637;SESSION: Understanding Visualizations;information visualization, infographics, empathy, compassion., anthropographics
"The Public Life of Data: Investigating&nbsp;Reactions&nbsp;to&nbsp;Visualizations&nbsp;on&nbsp;Reddit";https://dl.acm.org/doi/fullHtml/10.1145/3411764.3445720;SESSION: Understanding Visualizations;reddit, personal data, data visualization
Interpreting the Effect of Embellishment on Chart Visualizations;https://dl.acm.org/doi/fullHtml/10.1145/3411764.3445739;SESSION: Understanding Visualizations;text tagging, neural networks, gaze detection, datasets
Synthesis of Forms: Integrating Practical and Reflective Qualities in Design;https://dl.acm.org/doi/fullHtml/10.1145/3411764.3445232;SESSION: Design Methods / Speculative Futures / Performance / Gustation;Research through Design, Form-giving, Design process, Design Theory
Data Epics: Embarking on Literary Journeys of Home Internet of Things Data;https://dl.acm.org/doi/fullHtml/10.1145/3411764.3445241;SESSION: Design Methods / Speculative Futures / Performance / Gustation;Speculative, RtD, IoT, Home, Fiction, Epics, Data
Timelines: A World-Building Activity for Values Advocacy;https://dl.acm.org/doi/fullHtml/10.1145/3411764.3445447;SESSION: Design Methods / Speculative Futures / Performance / Gustation;values work, values in design, values advocacy, ethics, design fiction
In Tension with Progression: Grasping the Frictional Tendencies of Speculative, Critical, and other Alternative Designs;https://dl.acm.org/doi/fullHtml/10.1145/3411764.3445406;SESSION: Design Methods / Speculative Futures / Performance / Gustation;Speculative Design, Design Theory, Design Fiction, Design, Critical Design
RCO : Investigating Social and Technological Constraints through Interactive Dance;https://dl.acm.org/doi/fullHtml/10.1145/3411764.3445513;SESSION: Design Methods / Speculative Futures / Performance / Gustation;Performance led Research, Dance
Watching Myself Watching Birds: Abjection, Ecological Thinking, and Posthuman Design;https://dl.acm.org/doi/fullHtml/10.1145/3411764.3445329;SESSION: Design Methods / Speculative Futures / Performance / Gustation;sustainable HCI, research through making, posthumanism, Designing to decenter the human, Bird Watching, Autoethnography, Abjection
Freeform Fabrication of Fluidic Edible Materials;https://dl.acm.org/doi/fullHtml/10.1145/3411764.3445097;SESSION: Design Methods / Speculative Futures / Performance / Gustation;personal fabrication, edible interface, computational fabrication, Food printing, 3D printing
Data as Delight: Eating data;https://dl.acm.org/doi/fullHtml/10.1145/3411764.3445218;SESSION: Design Methods / Speculative Futures / Performance / Gustation;Human-Food Interaction, Food, Data Representation
Eyecam: Revealing Relations between Humans and Sensing Devices through an Anthropomorphic Webcam;https://dl.acm.org/doi/fullHtml/10.1145/3411764.3445491;SESSION: Design Methods / Speculative Futures / Performance / Gustation;Webcam, Ubiquitous computing, Sensing Devices, Critical Design, Anthropomorphism
Making Un-Use: When Humans Disengage with Technology;https://dl.acm.org/doi/fullHtml/10.1145/3411764.3445136;SESSION: Design Methods / Speculative Futures / Performance / Gustation;making un-use, human-artifact (dis-)engagements, discontinued use
How Design Researchers Interpret Probes: Understanding the Critical Intentions of a Designerly Approach to Research;https://dl.acm.org/doi/fullHtml/10.1145/3411764.3445328;SESSION: Design Methods / Speculative Futures / Performance / Gustation;design methods, Research through Design, Probes, Cultural Probes
Neuromancer Workshop: Towards Designing Experiential Entanglement with Science Fiction;https://dl.acm.org/doi/fullHtml/10.1145/3411764.3445273;SESSION: Design Methods / Speculative Futures / Performance / Gustation;Science fiction, Experiential speculation, Entanglement, Design fiction
Design in Action: Unpacking the Artists’ Role in Performance-Led Research;https://dl.acm.org/doi/fullHtml/10.1145/3411764.3445056;SESSION: Design Methods / Speculative Futures / Performance / Gustation;telepresence, performance-led research, interactive performance, collaborative design
Cracking Public Space Open: Design for Public Librarians;https://dl.acm.org/doi/fullHtml/10.1145/3411764.3445730;SESSION: Design for Public Spaces / VR Memorials / Textiles and Jewelry / Voice and Conversation / New Value Transactions;public library, infrastructuring, civic design, Public space
Floral Tribute Ritual in Virtual Reality: Design and Validation of SenseVase with Virtual Memorial;https://dl.acm.org/doi/fullHtml/10.1145/3411764.3445216;SESSION: Design for Public Spaces / VR Memorials / Textiles and Jewelry / Voice and Conversation / New Value Transactions;Thanatosensitive Design, Techno-spiritual Practices, Research through Design, Online Memorial, Mourning, Memorialization, Death Rituals, Commemoration
Generating the Presence of Remote Mourners: a Case Study of Funeral Webcasting in Japan;https://dl.acm.org/doi/fullHtml/10.1145/3411764.3445617;SESSION: Design for Public Spaces / VR Memorials / Textiles and Jewelry / Voice and Conversation / New Value Transactions;Thanato-sensitivity, Telepresence and Telexistence, Techno-spiritual practices, Mourning and Memorialization, Funeral, Death Rituals, 360-degree camera
EscapeLoom: Fabricating New Affordances for Hand Weaving;https://dl.acm.org/doi/fullHtml/10.1145/3411764.3445600;SESSION: Design for Public Spaces / VR Memorials / Textiles and Jewelry / Voice and Conversation / New Value Transactions;weaving, digital fabrication
Self-deStaining Textiles: Designing Interactive Systems with Fabric, Stains and Light;https://dl.acm.org/doi/fullHtml/10.1145/3411764.3445155;SESSION: Design for Public Spaces / VR Memorials / Textiles and Jewelry / Voice and Conversation / New Value Transactions;Smart Textiles, Self-Cleaning, LEDs
Heuristic Evaluation of Conversational Agents;https://dl.acm.org/doi/fullHtml/10.1145/3411764.3445312;SESSION: Design for Public Spaces / VR Memorials / Textiles and Jewelry / Voice and Conversation / New Value Transactions;user interface design, heuristic evaluation, conversational agents
Are Current Voice Interfaces Designed to Support Children’s Language Development?;https://dl.acm.org/doi/fullHtml/10.1145/3411764.3445271;SESSION: Design for Public Spaces / VR Memorials / Textiles and Jewelry / Voice and Conversation / New Value Transactions;young children, scaffolding, language development, Voice user interfaces
Designing a Conversational Agent for Sexual Assault Survivors: Defining Burden of Self-Disclosure and Envisioning Survivor-Centered Solutions;https://dl.acm.org/doi/fullHtml/10.1145/3411764.3445133;SESSION: Design for Public Spaces / VR Memorials / Textiles and Jewelry / Voice and Conversation / New Value Transactions;Sexual Assault Survivors, Self-Disclosure Burden, Conversational Agent (CA), Conversational AI, Chatbot
Lanterns: Configuring a Digital Resource to Inspire Preschool Children's Free Play Outdoors;https://dl.acm.org/doi/fullHtml/10.1145/3411764.3445745;SESSION: Design for Public Spaces / VR Memorials / Textiles and Jewelry / Voice and Conversation / New Value Transactions;tool-kits, tangibles, preschool, pervasive play, outdoor play, iot, interaction design, free play, children
Snowflakes: A Prototyping Tool for Computational Jewelry;https://dl.acm.org/doi/fullHtml/10.1145/3411764.3445173;SESSION: Design for Public Spaces / VR Memorials / Textiles and Jewelry / Voice and Conversation / New Value Transactions;wearable technology, smart jewellery, research through design, prototyping, maker, fabrication, development, design research, computational materials
CorpSum: Towards an Enabling Tool-Design for Language Researchers to Explore, Analyze and Visualize Corpora;https://dl.acm.org/doi/fullHtml/10.1145/3411764.3445145;SESSION: Design for Public Spaces / VR Memorials / Textiles and Jewelry / Voice and Conversation / New Value Transactions;Visual Design, Text/Speech/Language, Prototyping/Implementation
Creative Transactions: Special Digital Monies in ‘Break Kickstarter’ Crowdfunding Campaigns;https://dl.acm.org/doi/fullHtml/10.1145/3411764.3445632;SESSION: Design for Public Spaces / VR Memorials / Textiles and Jewelry / Voice and Conversation / New Value Transactions;Money, FinTech, Crowdfunding, Creative Transactions, Creative Industries
Enacting the Last Mile: Experiences of Smart Contracts in Courier Deliveries;https://dl.acm.org/doi/fullHtml/10.1145/3411764.3445525;SESSION: Design for Public Spaces / VR Memorials / Textiles and Jewelry / Voice and Conversation / New Value Transactions;logistics infrastructure, location data, last-mile logistics, distributed ledger technology, delivery, bicycle couriers, Smart contracts
IM Receptivity and Presentation-type Preferences among Users of a Mobile App with Automated Receptivity-status Adjustment;https://dl.acm.org/doi/fullHtml/10.1145/3411764.3445209;"SESSION: Mobile Studies, Mediation, &amp; Sharing / COVID-19 Pandemic Response";receptivity-status adjustment system, presence, mobile receptivity, availability
Scraps: Enabling Mobile Capture, Contextualization, and Use of Document Resources;https://dl.acm.org/doi/fullHtml/10.1145/3411764.3445185;"SESSION: Mobile Studies, Mediation, &amp; Sharing / COVID-19 Pandemic Response";writing, mobile, microtask, information scraps
The U in Crypto Stands for Usable: An Empirical Study of User Experience with Mobile Cryptocurrency Wallets;https://dl.acm.org/doi/fullHtml/10.1145/3411764.3445407;"SESSION: Mobile Studies, Mediation, &amp; Sharing / COVID-19 Pandemic Response";thematic analysis, review analysis, natural language processing, Cryptocurrency
Neighbourhood Wattch: Using Speculative Design to Explore Values Around Curtailment and Consent in Household Energy Interactions;https://dl.acm.org/doi/fullHtml/10.1145/3411764.3445095;"SESSION: Mobile Studies, Mediation, &amp; Sharing / COVID-19 Pandemic Response";values, smart energy, privacy, curtailment, consent, IoT, Energy use
Distress Disclosure across Social Media Platforms during the COVID-19 Pandemic: Untangling the Effects of Platforms, Affordances, and Audiences;https://dl.acm.org/doi/fullHtml/10.1145/3411764.3445134;"SESSION: Mobile Studies, Mediation, &amp; Sharing / COVID-19 Pandemic Response";stress, social networks, self-disclosure, mental health, affordances, Social media
No More Handshaking: How have COVID-19 pushed the expansion of computer-mediated communication in Japanese idol culture?;https://dl.acm.org/doi/fullHtml/10.1145/3411764.3445252;"SESSION: Mobile Studies, Mediation, &amp; Sharing / COVID-19 Pandemic Response";Japanese idol groups, Computer-mediated communication, COVID-19
Producing Liveness: The Trials of Moving Folk Clubs Online During the Global Pandemic;https://dl.acm.org/doi/fullHtml/10.1145/3411764.3445125;"SESSION: Mobile Studies, Mediation, &amp; Sharing / COVID-19 Pandemic Response";Zoom, YouTube, Social Media, Recording, Performance, Oral Tradition, Music, Liveness, Latency, Folk Music, Facebook, Ethnography, Delay, Audio, Appropriation
